Parent,Item,BARCODE,Closing,PRICE_AED, Prices us
Chopard,Chopard Leather Malaki Edp 80ml Spy,7640177361127,1 Pcs,235,$64.09 
Chopard,Chopard Magnolia au Vetiver dHaiti Edp 100ml Spy,7640177367419,70 Pcs,405,$110.44 
Chopard,Chopard Magnolia au Vetiver dHaiti Edp 10ml Mini Spy,7640177362377,120 Pcs,45,$12.27 
Chopard,Chopard Magnolia au Vetiver dHaiti Edp 3.5ml Mini,7640177362537,120 Pcs,20,$5.45 
Chopard,Chopard Miel D'Arabie Edp 100ml Spy,7640177367488,64 Pcs,425,$115.90 
Chopard,Chopard Miel D'Arabie Edp 3.5ml Mini,7640177362278,120 Pcs,20,$5.45 
Chopard,Chopard Miel D'Arabie Edp 50ml Spy,7640177367778,52 Pcs,330,$89.99 
Chopard,Chopard Neroli a la Cardamome du Guatemala Edp 100ml Spy,7640177367440,18 Pcs,405,$110.44 
Chopard,Chopard Neroli a la Cardamome du Guatemala Edp 100ml Tester,7640177368447,4 Pcs,345,$94.08 
Chopard,Chopard Neroli a la Cardamome du Guatemala Edp 10ml Mini Spy,7640177362407,82 Pcs,45,$12.27 
Chopard,Chopard Nuit Des Rois Edp 100ml Spy,7640177367495,18 Pcs,405,$110.44 
Chopard,Chopard Nuit Des Rois Edp 10ml Mini Spy,7640177363046,84 Pcs,45,$12.27 
Chopard,Chopard Orange Mauresque Edp 100ml Spy,7640177367457,13 Pcs,405,$110.44 
Chopard,Chopard Orange Mauresque Edp 10ml Mini Spy,7640177362322,93 Pcs,45,$12.27 
Chopard,Chopard Or De Calambac Edp 100ml Spy,7640177367501,28 Pcs,405,$110.44 
Chopard,Chopard Or De Calambac Edp 10ml Mini Spy,7640177363053,85 Pcs,45,$12.27 
Chopard,Chopard Oud Malaki Edp 80ml Spy,7640177360083,19 Pcs,147,$40.09 
Chopard,Chopard Patchouli de Sumatra Edp 100ml Spy,7640177363299,21 Pcs,405,$110.44 
Chopard,Chopard Rose Malaki Edp 80ml Spy,7640177360120,22 Pcs,125,$34.09 
Chopard,Chopard Rose Seljuke Edp 100ml Spy,7640177367471,26 Pcs,405,$110.44 
Chopard,Chopard Rose Seljuke Edp 10ml Mini Spy,7640177362353,94 Pcs,45,$12.27 
Chopard,Chopard Santal Odeyar Edp 100ml Spy,7640177363329,9 Pcs,405,$110.44 
Chopard,Chopard Vanille de Madagascar Edp 100ml Spy,7640177367433,45 Pcs,405,$110.44 
Chopard,Chopard Vanille de Madagascar Edp 10ml Mini Spy,7640177362391,120 Pcs,45,$12.27 
Chopard,Chopard Vetiver dHaiti au the Vert Edp 3.5ml Mini,7640177362544,120 Pcs,20,$5.45 
Chopard,Chopard Wish Brilliant W Edp 75ml Spy,7640177366412,24 Pcs,45,$12.27 
Chopard,Chopard Wish Pink W Edt 75ml Tester,7640177366320,12 Pcs,35,$9.54 
Christian Dior,Dior Addict Edp 100ml Spy,3348901181839,19 Pcs,385,$104.99 
Christian Dior,Dior Bois D'argent Edp 125ml Spy,3348900006263,3 Pcs,880,$239.98 
Christian Dior,Dior Fahrenheit Edt 100ml Spy,3348900012219,23 Pcs,350,$95.45 
Christian Dior,Dior Fahrenheit Edt 200ml Spy,3348900147324,2 Pcs,475,$129.53 
Christian Dior,Dior Gris Dior Edp 125ml Spy,3348901123020,9 Pcs,905,$246.80 
Christian Dior,Dior Homme Parfum 100ml Spy,3348901483896,22 Pcs,475,$129.53 
Christian Dior,Dior Hypnotic Poison Perfum 100ml Deo.Spy,3348900943315,7 Pcs,125,$34.09 
Christian Dior,Dior J'adore Edt 100ml Spy,3348901296632,120 Pcs,315,$85.90 
Christian Dior,Dior Miss Dior Rose N Rose Edt 50ml Spy,3348901500821,3 Pcs,220,$59.99 
Christian Dior,Dior Oud Ispahan Edp 125ml Spy,3348901011297,4 Pcs,905,$246.80 
Christian Dior,Dior Pure Poison W Edp 100ml Spy,3348900606715,62 Pcs,410,$111.81 
Christian Dior,Dior Sakura Edp 125ml Spy,,5 Pcs,905,$246.80 
Christian Dior,Dior Sauvage Edt 200ml Spy,3348901321129,2 Pcs,415,$113.17 
Christian Dior,Dior Vanilla Diorama Edp 250ml Spy,3348901589710,4 Pcs,"1,180.00",$321.79 
Clinique,Clinique Aromatics Elixir Perfume 100ml Spy,20714999346,120 Pcs,103,$28.09 
Clinique,Clinique Aromatics Elixir Perfume 45ml Spy,20714001940,113 Pcs,75,$20.45 
Clinique,Clinique Happy Heart W Parfum 100ml Spy,20714881429,120 Pcs,70,$19.09 
Clinique,Clinique Happy M 200ml Deo.Spy,20714089412,120 Pcs,13,$3.55 
Clinique,Clinique Happy M Edt 100ml Spy,20714080310,18 Pcs,70,$19.09 
Clinique,Clinique Happy W Parfum 100ml Spy,20714156893,120 Pcs,70,$19.09 
Clinique,Clinique Happy W Parfum 50ml Spy,20714052959,5 Pcs,55,$15.00 
Coach,Coach Dreams Sunset Edp 90ml Spy,3386460123501,8 Pcs,135,$36.81 
Coach,Coach Floral Blush W Edp 90ml Spy,3386460108119,10 Pcs,130,$35.45 
Coach,Coach W Edp 4.5ml Mini,3386460078344,120 Pcs,15,$4.09 
Coach,"Coach W Edp 90ml Spy
",3386460078306,7 Pcs,130,$35.45 
Cool & Cool,Cool & Cool Amber Divine Passion Edp 100ml Spy,5055810033255,1 Pcs,83,$22.63 
Cool & Cool,Cool & Cool Bakhoor Royal Ocean Edp 100ml Spy,5055810033262,1 Pcs,83,$22.63 
Cool & Cool,Cool & Cool Diamond Edp 100ml Spy,5055810045616,1 Pcs,39,$10.64 
Cool & Cool,Cool & Cool Musk Eternal Vogue Edp 100ml Spy,5055810033248,1 Pcs,83,$22.63 
Cool & Cool,Cool & Cool Oud Desert Gold Edp 100ml Spy,5055810033231,1 Pcs,83,$22.63 
Cool & Cool,Cool & Cool Platinum Edp 100ml Spy,5055810045623,1 Pcs,39,$10.64 
Costume National,Costume National Intense Red Edtion Edp 100ml Tester,8034041521905,4 Pcs,110,$30.00 
Costume National,Costume National Scents Intense Edp 50ml Spy,3760056100174,1 Pcs,105,$28.63 
Costume National,Costume National Super Gloss Edp 100ml Spy,8034041522377,8 Pcs,145,$39.54 
Costume National,Costume National Super Gloss Edp 100ml Tester,8034041522391,23 Pcs,105,$28.63 
Costume National,Costume National Super Gloss Edp 50ml Spy,8034041522384,9 Pcs,105,$28.63 
Creed,Creed Absolu Aventus Edp 75ml Spy,3508440251749,3 Pcs,"1,015.00",$276.79 
Creed,Creed Aqua Florentina Edp 75ml Spy,3508441104631,24 Pcs,640,$174.53 
Creed,Creed Aventus Cologne M Edp 100ml Spy,3508441001275,43 Pcs,680,$185.44 
Creed,Creed Aventus for Her Edp 75ml Spy,3508441104662,120 Pcs,680,$185.44 
Creed,Creed Aventus for Her Edp 75ml Tester,3508445604663,1 Pcs,480,$130.90 
Creed,Creed Aventus M Edp 100ml Spy,3508441001114,120 Pcs,810,$220.89 
Creed,Creed Aventus M Edp 100ml Tester,3508440561114,3 Pcs,610,$166.35 
Creed,Creed Aventus Soap 150g,3508444105420,8 Pcs,180,$49.09 
Creed,Creed Carmina Edp 75ml Spy,3508440251435,78 Pcs,780,$212.71 
Creed,Creed Carmina Edp 75ml Tester,3508440251442,17 Pcs,580,$158.17 
Creed,Creed Erolfa Edp 100ml Spy,3508441001015,24 Pcs,640,$174.53 
Creed,Creed Erolfa Edp 100ml Tester,3508440561015,2 Pcs,440,$119.99 
Creed,Creed Fleurissimo Edp 75ml Spy,3508441104174,28 Pcs,640,$174.53 
Creed,Creed Green Irish Tweed Edp 100ml Spy,3508441001022,120 Pcs,640,$174.53 
Creed,Creed Himalaya Edp 100ml Spy,3508441001084,25 Pcs,640,$174.53 
Creed,Creed Himalaya Edp 100ml Tester,3508440561084,12 Pcs,440,$119.99 
Creed,Creed Love in Black Edp 75ml Tester,3508445604601,8 Pcs,405,$110.44 
Creed,Creed Love in White Edp 75ml Spy,3508441104617,5 Pcs,580,$158.17 
Creed,Creed Millesime Imperial Edp 100ml Spy,3508441001039,94 Pcs,640,$174.53 
Creed,Creed Millesime Imperial Edp 100ml Tester,3508440561039,4 Pcs,440,$119.99 
Creed,Creed Neroli Sauvage Edp 100ml Spy,3508441001046,36 Pcs,640,$174.53 
Creed,Creed Neroli Sauvage Edp 100ml Tester,3508440561046,12 Pcs,440,$119.99 
Creed,Creed Original Santal Edp 100ml Spy,3508441001107,26 Pcs,640,$174.53 
Creed,Creed Original Santal Edp 100ml Tester,3508440561107,6 Pcs,440,$119.99 
Creed,Creed Original Vetiver Edp 100ml Spy,3508441001091,39 Pcs,640,$174.53 
Creed,Creed Original Vetiver Edp 100ml Tester,3508440561091,9 Pcs,440,$119.99 
Creed,Creed Queen of Silk Edp 75ml Spy,3508440251848,56 Pcs,860,$234.52 
Creed,Creed Queen of Silk Edp 75ml Tester,3508440251855,10 Pcs,660,$179.98 
Creed,Creed Royal Oud Edp 100ml Spy,3508441001121,120 Pcs,860,$234.52 
Creed,Creed Royal Oud Edp 100ml Tester,3508440561121,27 Pcs,660,$179.98 
Creed,Creed Royal Princess Oud Edp 75ml Spy,3508441104648,27 Pcs,640,$174.53 
Creed,Creed Royal Water Edp 100ml Spy,3508441001060,28 Pcs,640,$174.53 
Creed,Creed Royal Water Edp 100ml Tester,3508440561060,15 Pcs,440,$119.99 
Creed,Creed Silver Mountain Water Edp 100ml Spy,3508441001053,86 Pcs,640,$174.53 
Creed,Creed Spring Flower Edp 75ml Spy,3508440561800,14 Pcs,640,$174.53 
Creed,Creed Spring Flower Edp 75ml Tester,3508440561824,10 Pcs,440,$119.99 
Creed,Creed Viking Cologne Edp 100ml Spy,3508441001381,91 Pcs,580,$158.17 
Creed,Creed Viking Edp 100ml Tester,3508440561169,18 Pcs,560,$152.71 
Creed,Creed White Flowers Edp 75ml Spy,3508440752055,18 Pcs,860,$234.52 
Creed,Creed White Flowers Edp 75ml Tester,3508445752050,5 Pcs,660,$179.98 
Creed,Creed Wind Flower Edp 75ml Spy,3508440506856,29 Pcs,680,$185.44 
Creed,Creed Wind Flower Edp 75ml Tester,3508440506863,4 Pcs,480,$130.90 
Custo Barcelona,Pure Custo Barcelona M Edt 100ml Spy,8427395990242,49 Pcs,55,$15.00 
Custo Barcelona,Pure Custo Barcelona M Edt 100ml Tester,8427395997241,91 Pcs,35,$9.54 
Custo Barcelona,Pure Custo Barcelona M Edt 50ml Spy,8427395990143,120 Pcs,35,$9.54 
David Backham,David Backham Intimately M Edt 75ml Spy,5012874248872,70 Pcs,33,$9.00 
Davidoff,Davidoff Champion Edt 90ml Spy,3607340188602,32 Pcs,64,$17.45 
Davidoff,Davidoff Cool Water M Edt 125ml Spy,3414202000572,3 Pcs,80,$21.82 
Davidoff,Davidoff Cool Water M Edt 125ml Tester,3414202001227,4 Pcs,66,$18.00 
Davidoff,Davidoff Cool Water Sea Rose W Edt 100ml Spy,3607347462583,30 Pcs,74,$20.18 
Davidoff,Davidoff Cool Water W Edt 100ml Spy,3414202011752,120 Pcs,68,$18.54 
Davidoff,Davidoff Cool Water W Edt 100ml Tester,3414202011714,19 Pcs,48,$13.09 
Davidoff,Davidoff Cool Water W Edt 50ml Spy,3414202011769,2 Pcs,44,$12.00 
Davidoff,Davidoff Hot Water M Edt 110ml Spy,3607344163773,8 Pcs,53,$14.45 
Davidoff,Davidoff the Game Edt 100ml Spy,3607341186805,25 Pcs,61,$16.63 
Davidoff,Davidoff Zino Edt 125ml Spy,3414202000534,18 Pcs,52,$14.18 
DKNY,Dkny My NY W Edp 100ml Tester,,1 Pcs,85,$23.18 
DKNY,Dkny W Energizing (2018) Limited Edition Edt 100ml Spy,22548400012,4 Pcs,92,$25.09 
DKNY,Dkny W Energizing Edp 100ml Spy,763511100019,120 Pcs,114,$31.09 
Dolce & Gabana,D&G Devotion Edp 100ml Spy,8057971183739,4 Pcs,242,$65.99 
Dolce & Gabana,D&G Dolce Rose Edt 75ml Spy,3423222016234,3 Pcs,157,$42.81 
Dolce & Gabana,D&G K Edp 100ml Spy,3423473101253,26 Pcs,156,$42.54 
Dolce & Gabana,D&G K Edt 100ml Spy,3423473049456,11 Pcs,143,$39.00 
Dolce & Gabana,D&G K Edt 100ml Tester,3423473049463,6 Pcs,110,$30.00 
Dolce & Gabana,D&G K Edt 150ml Spy,3423473049654,15 Pcs,160,$43.63 
Dolce & Gabana,D&G L'imperatrice Edt 100ml Spy,3423222015565,2 Pcs,135,$36.81 
Dolce & Gabana,D&G Light Blue Eau Intense W Edp 100ml Spy,8057971181353,120 Pcs,178,$48.54 
Dolce & Gabana,D&G Light Blue M Edt 125ml+50mlSG+75mlASB Set,3423478775251,9 Pcs,180,$49.09 
Dolce & Gabana,D&G Light Blue M Edt 125ml Spy,3423473020516,11 Pcs,138,$37.63 
Dolce & Gabana,D&G Light Blue M Edt 125ml Tester,"737052139531
",17 Pcs,99,$27.00 
Dolce & Gabana,D&G Light Blue M Edt 75ml Spy,3423473020509,85 Pcs,99,$27.00 
Dolce & Gabana,D&G Light Blue W Edt 100ml Spy,8057971180318,120 Pcs,148,$40.36 
Dolce & Gabana,D&G Light Blue W Edt 100ml Tester,3423473026709,15 Pcs,115,$31.36 
Dolce & Gabana,D&G Pour Femme Edp 100ml Spy,8057971180400,25 Pcs,168,$45.81 
Dolce & Gabana,D&G Pour Homme Edt 125ml Spy,3423473020776,6 Pcs,135,$36.81 
Dolce & Gabana,D&G Pour Homme Edt 75ml Spy,"737052074443
",3 Pcs,105,$28.63 
Dolce & Gabana,D&G Queen Edp 100ml Spy,8057971183661,13 Pcs,212,$57.81 
Dolce & Gabana,D&G the One Gold W Edp Intense 75ml Spy,3423222015763,7 Pcs,233,$63.54 
Dolce & Gabana,D&G the One Intense M Edp 100ml Spy,8057971181568,8 Pcs,227,$61.90 
Dolce & Gabana,D&G the One M Edp 100ml Spy,8057971180547,6 Pcs,233,$63.54 
Dolce & Gabana,D&G the Only One 2 W Edp 100ml Tester,3423478580169,5 Pcs,150,$40.91 
Dorin,Dorin Un Air D'Amour Pour Monsieur Edp 80ml Spy,3495140002378,3 Pcs,195,$53.18 
Dorin,Dorin Un Air D'Amour Pour Monsieur Edp 80ml Tester,,2 Pcs,145,$39.54 
Dorin,Dorin Un Air D'Arabie Musc Edp 80ml Spy,3495140000176,6 Pcs,195,$53.18 
Dorin,Dorin Un Air D'Arabie Oud Edp 80ml Spy,3495514000152,6 Pcs,195,$53.18 
Dorin,Dorin Un Air D'Arabie Oud Edp 80ml Tester,,1 Pcs,145,$39.54 
Dorin,Dorin Un Air D'Arabie Rose De Taif Edp 80ml Spy,3495140000183,6 Pcs,195,$53.18 
Dorin,Dorin Un Air De Damas Fullah Edp 80ml Spy,3495140000138,9 Pcs,195,$53.18 
Dorin,Dorin Un Air De Damas Rose De Damas Edp 80ml Spy,3495140000114,11 Pcs,195,$53.18 
Dorin,Dorin Un Air De Damas Rose De Damas Edp 80ml Tester,,1 Pcs,145,$39.54 
Dorin,Dorin Un Air De Damas Tubereuse Edp 80ml Spy,3495140000145,6 Pcs,195,$53.18 
Dorin,Dorin Un Air De Paris Floral Edp 80ml Spy,3495140000084,8 Pcs,195,$53.18 
Dorin,Dorin Un Air De Paris Fruity Edp 80ml Spy,3495140000091,11 Pcs,195,$53.18 
Dorin,Dorin Un Air De Paris Fruity Edp 80ml Tester,,1 Pcs,145,$39.54 
Dorin,Dorin Un Air De Paris Spicy Edp 80ml Spy,3495140000107,7 Pcs,195,$53.18 
Dorin,Dorin Un Air De Paris Spicy Edp 80ml Tester,,1 Pcs,145,$39.54 
Dunhill,Dunhill Desire Blue Edt 100ml+226ml Body Spy,85715807533,6 Pcs,92,$25.09 
Dunhill,Dunhill Desire Blue M Edt 100ml Spy,85715801555,7 Pcs,72,$19.63 
Dunhill,Dunhill Desire Blue M Edt 150ml Spy,85715801623,32 Pcs,94,$25.63 
Dunhill,Dunhill Desire Blue Ocean M Edt 100ml Spy,85715801906,14 Pcs,82,$22.36 
Dunhill,Dunhill Desire Gold M Edt 100ml Spy,85715801968,22 Pcs,74,$20.18 
Dunhill,Dunhill Desire Red Edt 100ml+226ml Body Spy,85715807526,5 Pcs,94,$25.63 
Dunhill,Dunhill Desire Red M Edt 100ml Spy,85715801067,21 Pcs,74,$20.18 
Dunhill,Dunhill Desire Red M Edt 150ml Spy,85715801128,6 Pcs,94,$25.63 
Dunhill,Dunhill Driven Blue Edt 100 Ml Spy,85715807755,9 Pcs,70,$19.09 
Dunhill,Dunhill Edition Edt 100ml Spy,85715804013,57 Pcs,59,$16.09 
Dunhill,Dunhill Icon Absolute Edp 100ml Spy,85715806192,15 Pcs,112,$30.54 
Dunhill,Dunhill Icon Elite M Edp 100ml Spy,85715806116,4 Pcs,107,$29.18 
Dunhill,Dunhill Icon Racing Blue Edp 100ml Spy,85715806352,10 Pcs,102,$27.82 
Dunhill,Dunhill Icon Racing (Green) Edp 100ml Spy,85715806406,120 Pcs,92,$25.09 
Dunhill,Dunhill Icon Racing Red Edp 100ml Spy,85715806345,37 Pcs,102,$27.82 
Dunhill,Dunhill Pure Edt 75ml Spy,85715805911,13 Pcs,60,$16.36 
Dunhill,Dunhill Signature C.Agar Wood Edp 100ml Spy,85715807663,5 Pcs,165,$45.00 
Dunhill,Dunhill Signature C.Arabian Desert Edp 100ml Spy,85715806611,2 Pcs,165,$45.00 
Dunhill,Dunhill Signature C.British Leather Edp 100ml Spy,85715806635,1 Pcs,165,$45.00 
Dunhill,Dunhill Signature C.Indian Sandalwood Edp 100ml Spy,85715806642,2 Pcs,165,$45.00 
Dunhill,Dunhill Signature C.Valensole Lavander Edp 100ml Spy,85715807625,6 Pcs,165,$45.00 
Dunhill,Dunhill X Centric Edt 100ml Spy,85715805614,2 Pcs,60,$16.36 
Ekoz,Ekoz Decqde Blue 200ml Deo.Spy,6290171031000,1 Pcs,7,$1.91 
Ekoz,Ekoz Decqde Vert 200ml Deo.Spy,6290171031017,1 Pcs,7,$1.91 
Ekoz,Ekoz Fashion PF 200ml Deo.Spy,6290171030188,1 Pcs,7,$1.91 
Ekoz,Ekoz Gagra 200ml Deo.Spy,6290171030379,1 Pcs,7,$1.91 
Ekoz,Ekoz Glamorama PF 200ml Deo.Spy,6290171030195,1 Pcs,7,$1.91 
Ekoz,Ekoz GT Rouge 200ml Deo.Spy,6290171030393,1 Pcs,7,$1.91 
Ekoz,Ekoz GT Rouge Edp 100ml Spy,6290171030263,41 Pcs,24,$6.54 
Ekoz,Ekoz Just Sport PF 200ml Deo.Spy,6290171030218,1 Pcs,7,$1.91 
Ekoz,Ekoz Just Sport PH 200ml Deo.Spy,6290171030225,1 Pcs,7,$1.91 
Ekoz,Ekoz Just Sport Pour Femme Edp 100ml Spy,6290171030089,27 Pcs,24,$6.54 
Ekoz,Ekoz Just Sport Pour Homme Edp 100ml Spy,6290171030072,40 Pcs,24,$6.54 
Ekoz,Ekoz Not So Secret PF 200ml Deo.Spy,6290171030829,1 Pcs,7,$1.91 
Ekoz,Ekoz Not So Secret PH 200ml Deo.Spy,6290171030836,1 Pcs,7,$1.91 
Ekoz,Ekoz Soldier 200ml Deo.Spy,6290171030416,1 Pcs,7,$1.91 
EKW 4711 Cologne,4711 Original Edc 90ml Tester,4011700740185,95 Pcs,16.5,$4.50 
Elie Saab,Elie Saab Elixir Edp 100ml Spy,7640233341414,95 Pcs,185,$50.45 
Elie Saab,Elie Saab Elixir Edp 100ml Tester,7640233341438,30 Pcs,145,$39.54 
Elie Saab,Elie Saab Elixir Edp 10ml Mini Spy,7640233341483,120 Pcs,30,$8.18 
Elie Saab,Elie Saab Elixir Edp 30ml Spy,7640233341391,59 Pcs,90,$24.54 
Elie Saab,Elie Saab Elixir Edp 50ml Spy,7640233341407,120 Pcs,135,$36.81 
Elie Saab,Elie Saab Girl of Now Edp 10ml Mini Spy,7640233341087,120 Pcs,30,$8.18 
Elie Saab,Elie Saab Girl of Now Edp 30ml Spy,7640233340172,66 Pcs,90,$24.54 
Elie Saab,Elie Saab Girl of Now Edp 50ml Spy,7640233340189,63 Pcs,130,$35.45 
Elie Saab,Elie Saab Girl of Now Edp 90ml Spy,7640233340196,120 Pcs,175,$47.72 
Elie Saab,Elie Saab Girl of Now Forever Edp 50ml Spy,7640233340219,55 Pcs,130,$35.45 
Elie Saab,Elie Saab Girl of Now Forever Edp 90ml Spy,7640233340226,6 Pcs,175,$47.72 
Elie Saab,Elie Saab Girl of Now Forever Edp 90ml Tester,3423478481367,18 Pcs,130,$35.45 
Elie Saab,Elie Saab Girl of Now Lovely Edp 50ml Spy,7640233341063,31 Pcs,120,$32.72 
Elie Saab,Elie Saab Girl of Now Lovely Edp 90ml Spy,7640233341070,109 Pcs,165,$45.00 
Elie Saab,Elie Saab Girl of Now Rose Petal Edp 90ml Spy,7640233342466,29 Pcs,205,$55.90 
Elie Saab,Elie Saab Girl of Now Shine Edp 50ml Spy,7640233340240,48 Pcs,120,$32.72 
Elie Saab,Elie Saab Girl of Now Shine Edp 90ml Spy,7640233340257,78 Pcs,165,$45.00 
Elie Saab,Elie Saab Girl of Now Shine Edp 90ml Tester,7640233340288,29 Pcs,125,$34.09 
Elie Saab,Elie Saab Le Parfum Bridal Edp 90ml Spy,7640233341711,109 Pcs,185,$50.45 
Elie Saab,Elie Saab Le Parfume Edp 10ml Mini Spy,7640233340509,120 Pcs,30,$8.18 
Elie Saab,Elie Saab Le Parfume Edp 10ml Mini Spy Deluxe,7640233341261,120 Pcs,35,$9.54 
Elie Saab,Elie Saab Le Parfume Edp 30ml Spy,7640233340004,15 Pcs,90,$24.54 
Elie Saab,Elie Saab Le Parfume Edp 90ml Spy,7640233340035,89 Pcs,175,$47.72 
Elie Saab,Elie Saab Le Parfume Essentiel Edp 90ml Spy,7640233340066,82 Pcs,165,$45.00 
Elie Saab,Elie Saab Le Parfume Intense Edp 90ml Spy,3423473983255,22 Pcs,165,$45.00 
Elie Saab,Elie Saab Le Parfume Royal Edp 30ml Spy,7640233340073,45 Pcs,85,$23.18 
Elie Saab,Elie Saab Le Parfume Royal Edp 50ml Spy,7640233340080,41 Pcs,120,$32.72 
Elie Saab,Elie Saab Le Parfume Royal Edp 90ml Spy,7640233340097,1 Pcs,165,$45.00 
Elie Saab,Elie Saab Le Parfume Royal Edp 90ml Tester,7640233340158,25 Pcs,125,$34.09 
Elie Saab,Elie Saab Le Parfume White Edp 30ml Spy,7640233340103,49 Pcs,90,$24.54 
Elie Saab,Elie Saab Le Parfume White Edp 50ml Spy,7640233340110,44 Pcs,130,$35.45 
Elie Saab,Elie Saab Le Parfume White Edp 90ml Spy,7640233340127,39 Pcs,175,$47.72 
Elie Saab,Elie Saab Le Parfum Lumiere Edp 50ml Spy,7640233340714,26 Pcs,120,$32.72 
Elizabeth Arden,EA.5th Avenue Edp 125ml Spy,85805390600,120 Pcs,62,$16.91 
Elizabeth Arden,EA.Arden Beauty Edp 100ml Spy,85805785345,120 Pcs,45,$12.27 
Elizabeth Arden,EA.Green Tea Scent Ep 100ml Spy,85805268848,90 Pcs,36,$9.82 
Elizabeth Arden,EA.Red Door Edt 100ml Spy,85805558420,47 Pcs,62,$16.91 
Elizabeth Arden,EA.Splendor Edp 125ml Spy,85805120900,54 Pcs,45,$12.27 
Elizabeth Arden,EA.White Tea Edt 100ml Spy,85805557331,18 Pcs,64,$17.45 
Elizabeth Taylor,ET.White Diamond Edt 100ml Spy,719346022705,30 Pcs,62,$16.91 
Enricogi,Enricogi Oud Magnifico Edp 100ml Spy,7674182001105,1 Pcs,205,$55.90 
Escada,Escada Especially Deliate Note Edt 75ml Spy,737052565095,1 Pcs,92,$25.09 
Escada,Escada Magnetism W Edp 75ml Spy,3614227293960,120 Pcs,96,$26.18 
Escentric Molecules,EM.Escentric 05 Edt 100ml Spy,5060103310593,8 Pcs,385,$104.99 
Escentric Molecules,EM.Molecule 05 Edt 100ml Spy,5060103310609,5 Pcs,385,$104.99 
Estee Lauder,EL.Aliage (2015) Edp 50ml Spy,887167095847,90 Pcs,130,$35.45 
Estee Lauder,EL.Azuree (2015) Edp 50ml Spy,887167095854,120 Pcs,125,$34.09 
Estee Lauder,EL.Beautiful W Edp 30ml Spy,27131086864,120 Pcs,75,$20.45 
Estee Lauder,EL.Beautiful W Edp 75ml Spy,27131086871,120 Pcs,114,$31.09 
Estee Lauder,EL.Cinnabar (2015) Edp 50ml Spy,887167095878,115 Pcs,143,$39.00 
Estee Lauder,EL.Estee (2015) Edp 50ml Spy,887167095885,119 Pcs,125,$34.09 
Estee Lauder,EL.Knowing W Edp 75ml Spy,27131006534,120 Pcs,150,$40.91 
Estee Lauder,EL.Modern Muse W Edp 50ml Spy,27131261612,105 Pcs,125,$34.09 
Estee Lauder,EL.Pleasures Intense W Edp 100ml Spy,27131286905,85 Pcs,155,$42.27 
Estee Lauder,EL.Pleasures M Edc 100ml Spy,27131521433,3 Pcs,92,$25.09 
Estee Lauder,EL.Pleasures W Edp 100ml Spy,27131043317,120 Pcs,114,$31.09 
Estee Lauder,EL.Pleasures W Edp 30ml Spy,27131043287,39 Pcs,64,$17.45 
Estee Lauder,EL.Pleasures W Edp 50ml Spy,27131043294,2 Pcs,86,$23.45 
Estee Lauder,EL.Private Collection 50ml Spy,27131019817,120 Pcs,125,$34.09 
Estee Lauder,EL.Sensuous W Edp 50ml Spy,27131595045,113 Pcs,110,$30.00 
Estee Lauder,EL.White Linen Edp 60ml Spy,27131020424,120 Pcs,110,$30.00 
Estee Lauder,EL.Youth Dew W Edp 67ml Spy,27131017752,57 Pcs,77,$21.00 
Etat Libre D'orange,Etat Libre You Or Someone Like You Edp 100ml Spy,3760168591662,1 Pcs,255,$69.54 
Etienne Aigner,Aigner Iconista Edp 100ml Spy,4013670000900,6 Pcs,95,$25.91 
Etienne Aigner,Aigner No.1 PH Edt 100ml Spy,4013670508314,7 Pcs,68,$18.54 
Etienne Aigner,Aigner No.1 PH Edt 50ml Spy,4013670508390,2 Pcs,44,$12.00 
Etienne Aigner,Aigner No.1 PH Intense Edt 100ml Spy,4013671000084,6 Pcs,58,$15.82 
Etienne Aigner,Aigner Too Feminine Edp 100ml Spy,4013670502930,8 Pcs,80,$21.82 
Ex Nihilo,Ex Nihilo Fleur Narcotique Edp 100ml Tester,3760264090588,7 Pcs,525,$143.17 
Fla Via Parfum,Flavia Aoud Heritage Edp 100ml Spy,6294015165364,1 Pcs,62,$16.91 
Fla Via Parfum,Flavia B'afric Edp 100ml Spy,6294015150759,1 Pcs,53,$14.45 
Fla Via Parfum,Flavia Blackart Rouge Intense Edp 100ml Spy,6294015151701,1 Pcs,53,$14.45 
Fla Via Parfum,Flavia Dominent Coll. Amber Elixir Edp 100ml Spy,6294015174403,1 Pcs,62,$16.91 
Fla Via Parfum,Flavia Dominent Coll. Flavia Pearl Edp 100ml Spy,6294015174427,1 Pcs,62,$16.91 
Fla Via Parfum,Flavia Dominent Coll. Imperio Intense Edp 100ml Spy,6294015174410,1 Pcs,62,$16.91 
Fla Via Parfum,Flavia Elite Edp 100ml Spy,6294015156973,1 Pcs,53,$14.45 
Fla Via Parfum,Flavia Fairy Tale Share Edp 100ml Spy,6294015164886,1 Pcs,62,$16.91 
Fla Via Parfum,Flavia Initial Edp 100ml Spy,6294015157017,1 Pcs,53,$14.45 
Fla Via Parfum,Flavia Italian Leather Edp 100ml Spy,6294015164879,1 Pcs,53,$14.45 
Fla Via Parfum,Flavia Just for You Aoud Edp 100ml Spy,6294015165234,1 Pcs,62,$16.91 
Fla Via Parfum,Flavia Kissme for Woman Edp 100ml Spy,6294015151732,1 Pcs,53,$14.45 
Fla Via Parfum,Fla Via Koral Pour Homme Edp 100ml Spy,6294015151749,1 Pcs,53,$14.45 
Fla Via Parfum,Flavia Majestic Oud Intense Edp 100ml Spy,6294015160628,2 Pcs,62,$16.91 
Fla Via Parfum,Flavia MF Pure Scent Edp 100ml Spy,6294015165371,1 Pcs,62,$16.91 
Fla Via Parfum,Flavia Nouveau Ambre Parfum 100ml Spy,6294015156126,1 Pcs,53,$14.45 
Fla Via Parfum,Flavia P by Prince Edp 85ml Spy,6294015165203,2 Pcs,62,$16.91 
Fla Via Parfum,Flavia Rose & Oud Edp 90ml Spy,6294015151770,1 Pcs,53,$14.45 
Fla Via Parfum,Flavia Royale Crown Edp 100ml Spy,6294015165272,1 Pcs,62,$16.91 
Fla Via Parfum,Flavia Vanilla & Tobacco Edp 100ml Spy,6294015150773,1 Pcs,53,$14.45 
Fly Falcon,Fly Falcon Boyaka Edp 85ml Spy,6290116543209,1 Pcs,52,$14.18 
Fly Falcon,Fly Falcon Pure Touch Edp 60ml Spy,3458575954216,120 Pcs,50,$13.64 
Fly Falcon,Fly Falcon Pure Touch Limited 60ml Spy,3457896812663,111 Pcs,50,$13.64 
Franck Olivier,Franck Olivier Baby Boy Edp Bebe 30ml Spy,3516642166846,32 Pcs,29,$7.91 
Franck Olivier,Franck Olivier Baby Girl Edp Bebe 30ml Spy,3516642165849,23 Pcs,29,$7.91 
Franck Olivier,Franck Olivier Black Touch M Edt 100ml Spy,3516640917112,48 Pcs,40,$10.91 
Franck Olivier,Franck Olivier Blue Touch M Edt 100ml Spy,3516642130113,46 Pcs,40,$10.91 
Franck Olivier,Franck Olivier Excellence M Edt 100ml Spy,3516642064111,2 Pcs,42,$11.45 
Franck Olivier,Franck Olivier Nature Pour Elle Edp 75ml Spy,3516640825325,17 Pcs,40,$10.91 
Franck Olivier,Franck Olivier Night Touch M Edt 100ml Spy,3516641417116,35 Pcs,40,$10.91 
Franck Olivier,Franck Olivier Oud Touch Edp 100ml Spy,3516641317317,34 Pcs,42,$11.45 
Franck Olivier,Franck Olivier Oud Vanille Edp 100ml Spy,3516641717315,120 Pcs,42,$11.45 
Franck Olivier,Franck Olivier Pure Addiction Edp 100ml Spy,3516642063312,93 Pcs,42,$11.45 
Franck Olivier,Franck Olivier Pure Femme Edp 100ml Spy,3516642062315,26 Pcs,42,$11.45 
Franck Olivier,Franck Olivier Pure Homme Edt 100ml Spy,3516642062117,29 Pcs,40,$10.91 
Franck Olivier,Franck Olivier Sunrise M Edt 75ml Spy,3516641030124,22 Pcs,40,$10.91 
Franck Olivier,Franck Olivier W Edp 50ml Spy,3516642101335,53 Pcs,32,$8.73 
Franck Olivier,Franck Olivier White Touch W Edt 100ml Spy,3516640917310,12 Pcs,40,$10.91 
Geoffrey Beene,Grey Flannel Edt 120ml Spy,719346021814,18 Pcs,48,$13.09 
Geparlys,Geparlys Absolute Innocence W  Edp 100ml Spy,3700134410207,5 Pcs,60,$16.36 
Geparlys,Geparlys Adnan B.Noir M Edp 100ml Spy,3700134406750,5 Pcs,52,$14.18 
Geparlys,Geparlys Ambre Noir M Edp 90ml Spy,3700134410061,3 Pcs,52,$14.18 
Geparlys,Geparlys Ambre Nuit M Edp 100ml Spy,3700134409850,5 Pcs,52,$14.18 
Geparlys,Geparlys Armorial Leather M Edp 100ml Spy,3700134409638,7 Pcs,77,$21.00 
Geparlys,Geparlys Armorial Leather Oud M Edp 100ml Spy,3700134409645,8 Pcs,77,$21.00 
Geparlys,Geparlys Arty Mind W Edp 100ml Spy,3700108350447,6 Pcs,45,$12.27 
Geparlys,Geparlys Bella Flower W Edp 85ml Spy,3700134410214,2 Pcs,60,$16.36 
Geparlys,Geparlys Dania D'or W  Edp 100ml Spy,3700134410252,6 Pcs,42,$11.45 
Geparlys,Geparlys Flower Blossom W Edp 85ml Spy,3700134409812,3 Pcs,60,$16.36 
Geparlys,Geparlys for King II M Edp 100ml Spy,3700134411440,6 Pcs,70,$19.09 
Geparlys,Geparlys Idole M Edt 90ml Spy,3700134408488,6 Pcs,52,$14.18 
Geparlys,Geparlys Infinite Pleasure Blue Light Edp 100ml Spy,3700134402882,1 Pcs,55,$15.00 
Geparlys,Geparlys Joyfull for Woman Edp 85ml Spy,3700134410689,5 Pcs,56,$15.27 
Geparlys,Geparlys Jungle of the King M Edp 100ml Spy,3700134410122,1 Pcs,77,$21.00 
Geparlys,Geparlys Life Is Celebration W Edp 85ml Spy,3700134406361,1 Pcs,57,$15.54 
Geparlys,Geparlys Parnassia Black Crystal W Edp 95ml Spy,3700134409959,6 Pcs,52,$14.18 
Geparlys,Geparlys Rich Blue Icone M Edp 90ml Spy,3700134409102,6 Pcs,49,$13.36 
Geparlys,Geparlys Si Belle W Edp 85ml Spy,3700134410641,1 Pcs,56,$15.27 
Geparlys,Geparlys Yes I Am the King Legend M Edp 100ml Spy,3700134410290,20 Pcs,77,$21.00 
