Parent,Item,BARCODE,Closing,PRICE_AED, Prices us
Kilian,Kilian Straight to Heaven Edp 100ml Refill Tester,3700550223146,31 Pcs,385,$104.99 
Kilian,Kilian Straight to Heaven Edp 100ml Refill Tester (New),3700550223146',5 Pcs,480,$130.90 
Kilian,Kilian Straight to Heaven Edp 50ml Refill,3760167023249,5 Pcs,385,$104.99 
Kilian,Kilian Vodka on the Rocks Edp 100ml Refill Tester,3700550263746,4 Pcs,385,$104.99 
Kilian,Kilian Vodka on the Rocks Edp 50ml Refill,3760184353749,5 Pcs,385,$104.99 
Kilian,Kilian Voulez-Vouz Coucher Avec Moi Edp 100ml Refil Tester (New),3700550263555',6 Pcs,480,$130.90 
Kilian,Kilian Woman in Gold Edp 100ml Refill Tester,3700550282624,17 Pcs,385,$104.99 
Kilian,Kilian Woman in Gold Edp 100ml Refill Tester (New),3700550282624',6 Pcs,480,$130.90 
Kim Kardashian,Kim Kardashian Gold Edp 100ml Spy,49398940055,14 Pcs,58,$15.82 
Korloff,Korloff Royal Oud 150ml Deo.Spy,3760251870193,120 Pcs,20,$5.45 
La Beaute,La Beaute Rouge Secret N3 Edp 120ml Spy,7426968203193,1 Pcs,60,$16.36 
Label Fine Perfumes,Label Oud & Musk Edp 50ml Spy,8437020930260,5 Pcs,180,$49.09 
Label Fine Perfumes,Label Ylang Ylang & Musk Edp 50ml Spy,8437020930246,2 Pcs,180,$49.09 
Lacoste,Eau De Lacoste L.12.12 Blanc 150ml Deo.Spy,8005610668987,120 Pcs,30,$8.18 
Lacoste,Eau De Lacoste Noir Edt 100ml Spy,737052662664`,18 Pcs,115,$31.36 
Lacoste,Lacoste Booster M Edt 125ml Spy,3616302931897,17 Pcs,112,$30.54 
Lacoste,Lacoste L.12.12 Blanc 70ml Deo.Stick,737052978420,53 Pcs,37,$10.09 
Lacoste,Lacoste Red M Edt 125ml Spy,3616302931781,18 Pcs,121,$33.00 
Lacoste,Lacoste Touch of Pink W Edt 90ml Spy,737052191324,6 Pcs,97,$26.45 
Lalique,Lalique Amesthyst W Edp 100ml Spy,3454960023284,106 Pcs,69,$18.82 
Lalique,Lalique Encre Noire A L'extreme PH Edp 100ml Spy,7640111502791,20 Pcs,72,$19.63 
Lalique,Lalique Encre Noire M Edt 100ml Spy,3454960022522,120 Pcs,68,$18.54 
Lalique,Lalique Encre Noir Sport PH Edt 100ml Spy,7640111500902,5 Pcs,69,$18.82 
Lalique,Lalique L'amour W Edp 100ml Spy,7640111499060,13 Pcs,88,$24.00 
Lalique,Lalique Le Parfum W Edp 100ml Spy,3454960020917,2 Pcs,72,$19.63 
Lalique,Lalique Les CP Oriental Zinc Edp 100ml Spy,7640111502968,3 Pcs,145,$39.54 
Lalique,Lalique Les CP Woody Gold Edp 100ml Tester,7640111503118,1 Pcs,115,$31.36 
Lalique,Lalique Lion PH Edp 125ml Spy,3454960007468,2 Pcs,78,$21.27 
Lalique,Lalique Ombre Noir PH Edp 100ml Spy,7640171199153,120 Pcs,103,$28.09 
Lalique,Lalique W Edp 100ml Spy,3454960014664,1 Pcs,88,$24.00 
Lalique,Lalique White PH Edt 125ml Spy,3454960024021,51 Pcs,70,$19.09 
Lancome,Lancome Crayon Khol Eye Liner Pencil 1.2g  Assorted,,15 Pcs,15,$4.09 
Lancome,Lancome Hypnose W Edp 75ml Spy,3147758235500,15 Pcs,255,$69.54 
Lancome,Lancome Idole Aura W Edp Lumineuse 100ml Spy,3614273476164,43 Pcs,250,$68.18 
Lancome,Lancome Idole L'Intense Edp 75ml Spy,3614273203487,12 Pcs,270,$73.63 
Lancome,Lancome Idole Nectar W Edp Lumineuse 100ml Spy,3614273749558,5 Pcs,260,$70.90 
Lancome,Lancome Idole Now W Edp Florale 100ml Spy,3614273927321,11 Pcs,250,$68.18 
Lancome,Lancome La Vie Est Belle Soleil Cristal Edp 100ml Spy,3614273357197,50 Pcs,255,$69.54 
Lancome,Lancome La Vie Est Belle W Edp 100ml Spy,3605533286555,28 Pcs,275,$74.99 
Lancome,Lancome La Vie Est Belle W Edp 75ml Spy,3605532612836,1 Pcs,225,$61.36 
Lancome,Lancome Maison Magnolia Rosae Edp 100ml Spy,3614272451995,11 Pcs,365,$99.54 
Lancome,Lancome Maison Mille Et Une Roses Edp 100ml Spy,3614273747806,4 Pcs,295,$80.45 
Lancome,Lancome Maison Oud Bouquet Edp 100ml Spy,3614271220431,22 Pcs,455,$124.08 
Lancome,Lancome Maison Peut Etre Edp 100ml Spy,3614272898486,15 Pcs,455,$124.08 
Lancome,Lancome Miracle W Edp 100ml Spy,3147758029383,14 Pcs,225,$61.36 
Lancome,Lancome Poeme W Edp 100ml Spy,3147758155112,16 Pcs,285,$77.72 
Lancome,Lancome Tresor La Nuit Edp 100ml Spy,3614270754074,43 Pcs,295,$80.45 
Lancome,Lancome Tresor Midnight Rose W L'Edp 50ml Spy,3605532423203,21 Pcs,180,$49.09 
Lancome,Lancome Tresor Midnight Rose W L'Edp 75ml Spy,3605532423265,12 Pcs,270,$73.63 
Lancome,Lancome Tresor W Edp 100ml Spy,3147758034929,2 Pcs,255,$69.54 
Lanvin,Lanvin Eclat W Edp 100ml Spy,3386461515671,120 Pcs,99,$27.00 
Lanvin,Lanvin Jeanne W Edp 100ml Spy,3386460010399,19 Pcs,84,$22.91 
Lanvin,Lanvin Jeanne W Edp 100ml Unbox Tester,,1 Pcs,44,$12.00 
Lanvin,Lanvin L'homme Edt 100ml Spy,3386461515732,12 Pcs,61,$16.63 
Lanvin,Lanvin Modern Princess Eau Sensuelle W Edt 90ml Spy,3386460096102,10 Pcs,63,$17.18 
Lanvin,Lanvin Oxygene M Edt 100ml Spy,3139093035228,12 Pcs,59,$16.09 
Lanvin,Lanvin Oxyzene W Edp 75ml Spy,3139093021429,19 Pcs,63,$17.18 
Lanvin,Lanvin Rumeur Rose 2 W Edp 100ml Spy,3386460007078,9 Pcs,70,$19.09 
Lattafa,Lattafa Afkaar Edp 100ml Spy,6291108730577,6 Pcs,40,$10.91 
Lattafa,Lattafa Ajayeb Dubai Portrait Edp 100ml Spy,6290360591568,2 Pcs,40,$10.91 
Lattafa,Lattafa Ajwad Edp 60ml Spy,6291108732489,120 Pcs,48,$13.09 
Lattafa,Lattafa Ajwad Pink to Pink Edp 100ml Spy,6290360597133,117 Pcs,50,$13.64 
Lattafa,Lattafa Al Azal Edp 100ml Spy,6291107457086,8 Pcs,36,$9.82 
Lattafa,Lattafa Al Nashama Caprice Edp 100ml Spy,,5 Pcs,61,$16.63 
Lattafa,Lattafa Al Nashama Edp 100ml Spy,,10 Pcs,61,$16.63 
Lattafa,Lattafa Al Noble Ameer Edp 100ml Spy,6291108737996,3 Pcs,45,$12.27 
Lattafa,Lattafa Al Noble Safeer Edp 100ml Spy,6291108738009,4 Pcs,45,$12.27 
Lattafa,Lattafa Al Noble Wazeer Edp 100ml Spy,6291108737866,15 Pcs,45,$12.27 
Lattafa,Lattafa Ameer Al Oud Edp 100ml+50ml Deo.Spy,6291106063707`,24 Pcs,32,$8.73 
Lattafa,Lattafa Ameer Al Oud Edp 100ml Spy,6291106063707,11 Pcs,32,$8.73 
Lattafa,Lattafa Ameer Al Oud Edp Intense Oud 100ml Spy,6291107458571,71 Pcs,36,$9.82 
Lattafa,Lattafa Ana Abiyedh Edp 30ml Spy,6291108731178,28 Pcs,17,$4.64 
Lattafa,Lattafa Ana Abiyedh Edp 60ml Spy,6291106066890,43 Pcs,36,$9.82 
Lattafa,Lattafa Ana Abiyedh Leather Edp 60ml Spy,6291107454429,4 Pcs,36,$9.82 
Lattafa,Lattafa Ana Abiyedh Poudree Edp 60ml Spy,6291108733226,33 Pcs,36,$9.82 
Lattafa,Lattafa Ana Abiyedh Rouge Edp 60ml Spy,6291107454412,29 Pcs,36,$9.82 
Lattafa,Lattafa Andaleeb Edp 100ml Spy,6291107456379,1 Pcs,36,$9.82 
Lattafa,Lattafa Asad Edp 100ml Spy,6291108735411,29 Pcs,48,$13.09 
Lattafa,Lattafa Aura Edp 60ml Spy,,11 Pcs,61,$16.63 
Lattafa,Lattafa Awraq Al Oud Edp 100ml Spy,6291107453675`,2 Pcs,30,$8.18 
Lattafa,Lattafa Badee Al Oud 200ml Deo Spy,6291108734865,1 Pcs,6.6,$1.80 
Lattafa,Lattafa Badee Al Oud Air Freshner 300ml Spy,6291108735121,14 Pcs,6,$1.64 
Lattafa,Lattafa Badee Al Oud Amethyst Air Freshner 300ml,6291108738931,12 Pcs,6,$1.64 
Lattafa,Lattafa Badee Al Oud Amethyst Edp 100ml Spy,6291108733875,86 Pcs,61,$16.63 
Lattafa,Lattafa Badee Al Oud Honor & Glory Edp 100ml Spy,6290360593135,48 Pcs,61,$16.63 
Lattafa,Lattafa Badee Al Oud Oud for Glory Edp 100ml Spy,6291107458328,120 Pcs,61,$16.63 
Lattafa,Lattafa Badee Al Oud Sublime Edp 100ml Spy,6290360593142,72 Pcs,61,$16.63 
Lattafa,Lattafa Confidencial Private Gold Edp 100ml Spy,6291107459707,101 Pcs,34,$9.27 
Lattafa,Lattafa Ejaazi Edp 100ml Spy,6291106069020,2 Pcs,30,$8.18 
Lattafa,Lattafa Ejaazi Intensive Silver Edp 100ml Spy,6291108734032,13 Pcs,30,$8.18 
Lattafa,Lattafa Emaan Edp 100ml Spy,6291108738498,29 Pcs,64,$17.45 
Lattafa,Lattafa Emeer Edp 100ml Spy,6290360591506,8 Pcs,82,$22.36 
Lattafa,Lattafa Fakhar Gold Bukhoor 100Gm,6291108735077,9 Pcs,24,$6.54 
Lattafa,Lattafa Fakhar Gold Extrait Edp 100ml Spy,6290360593166,59 Pcs,50,$13.64 
Lattafa,Lattafa Fakhar Latafa (Rose) Air Freshner 300ml Spy,6291108735138,10 Pcs,6,$1.64 
Lattafa,Lattafa Fakhar M (Silver) Edp 100ml Spy,6291107456058,83 Pcs,50,$13.64 
Lattafa,Lattafa Fakhar W (Rose) 200ml Deo Spy,6291108735299,65 Pcs,6,$1.64 
Lattafa,Lattafa Fakhar W (Rose) Edp 100ml Spy,6291107456041,86 Pcs,50,$13.64 
Lattafa,Lattafa Hayaati Al Maleky Edp 100ml Spy,6291108734056,11 Pcs,32,$8.73 
Lattafa,Lattafa Haya (Pink) Edp 100ml Spy,6291108738504,32 Pcs,64,$17.45 
Lattafa,Lattafa Hayati Gold Elixir Edp 100ml Spy,6291107457895,44 Pcs,32,$8.73 
Lattafa,Lattafa Hayati Silver 200ml Body Spy,,48 Pcs,6,$1.64 
Lattafa,Lattafa Hayati Silver Edp 100ml Spy,6291107450193,35 Pcs,32,$8.73 
Lattafa,Lattafa I Am White Air Freshner 300ml Spy,6291107454399,11 Pcs,6,$1.64 
Lattafa,Lattafa Just Oud Bouleverd Edition Edp 90ml Spy,6291106062274,14 Pcs,29,$7.91 
Lattafa,Lattafa Khaltat Arabia Royal Delight Edp 100ml Spy,,7 Pcs,35,$9.54 
Lattafa,Lattafa Khamrah 200ml Deo Spy,6290360593241,35 Pcs,6.6,$1.80 
Lattafa,Lattafa Khamrah Qahwa Edp 100ml Spy,6290360593661,17 Pcs,80,$21.82 
Lattafa,Lattafa Khashabi Edp 100ml Spy,6291107450780,4 Pcs,39,$10.64 
Lattafa,Lattafa Lail Malaki Edp 100ml Spy,6291107451527,70 Pcs,31,$8.45 
Lattafa,Lattafa Lail Malaki Oud Edp 100ml Spy,6291107459035,46 Pcs,31,$8.45 
Lattafa,Lattafa Ma'ani Edp 100ml Spy,6291107456386,23 Pcs,33,$9.00 
Lattafa,Lattafa Maahir 200ml Deo. Spy,6291108734896,104 Pcs,6,$1.64 
Lattafa,Lattafa Maahir Air Freshner 300ml Spy,6291108735152,12 Pcs,6,$1.64 
Lattafa,Lattafa Maahir Black Edition Air Freshner 300ml Spy,6291108735169,14 Pcs,6,$1.64 
Lattafa,Lattafa Maahir Black Edition Edp 100ml Spy,6291108730362,91 Pcs,62,$16.91 
Lattafa,Lattafa Maahir Edp 100ml Spy,6291107456744`,1 Pcs,64,$17.45 
Lattafa,Lattafa Maahir Gold Edition Edp 100ml Spy,6291107456744,9 Pcs,62,$16.91 
Lattafa,Lattafa Maahir Legacy Edp 100ml Spy,6290360590189,11 Pcs,62,$16.91 
Lattafa,Lattafa Mohra Edp 100ml Spy,6291108735589,8 Pcs,39,$10.64 
Lattafa,Lattafa Musamam Edp 100ml Spy,6291108737323,45 Pcs,84,$22.91 
Lattafa,Lattafa Musk Mood Edp 100ml Spy,6291107452357,21 Pcs,38,$10.36 
Lattafa,Lattafa Najdia Edp 100ml+50ml Deo Spy,6291106063233,31 Pcs,31,$8.45 
Lattafa,Lattafa Najdia in Gold Edp 100ml Spy,6291106066098,17 Pcs,32,$8.73 
Lattafa,Lattafa Najdia Tribute Edp 100ml Spy,6291108733882,1 Pcs,29,$7.91 
Lattafa,Lattafa Opulent Musk Edp 100ml Spy,6291107450445,12 Pcs,34,$9.27 
Lattafa,Lattafa Opulent Oud Edp 100ml Spy,6291107450438,40 Pcs,34,$9.27 
Lattafa,Lattafa Oudain Edp 100ml Spy,6291108733219,103 Pcs,38,$10.36 
Lattafa,Lattafa Oud Mood Air Freshner 300ml Spy,6291106069327,11 Pcs,6,$1.64 
Lattafa,Lattafa Oud Mood Edp 100ml Spy,6291106065114,75 Pcs,38,$10.36 
Lattafa,Lattafa Oud Mood Elixier Edp 100ml Spy,6291106068177,84 Pcs,38,$10.36 
Lattafa,Lattafa Oud Mood Reminiscence Edp 100ml Spy,6291106068184,2 Pcs,38,$10.36 
Lattafa,Lattafa Oud Najdia Edp 100ml Spy,6291106066159,6 Pcs,30,$8.18 
Lattafa,Lattafa Pride Nebras Edp 100ml Spy,6291108738276,26 Pcs,110,$30.00 
Lattafa,Lattafa Pure Musk Edp 100ml+50ml Deo.Spy,6291106060546,19 Pcs,31,$8.45 
Lattafa,Lattafa Pure Oudi Air Freshner 300ml Spy,6291106067439,12 Pcs,6,$1.64 
Lattafa,Lattafa Qaa'ed Air Freshner 300ml Spy,6291108735176,9 Pcs,6,$1.64 
Lattafa,Lattafa Qaa'ed Al Fursan Edp 100ml Spy,6291107455365,30 Pcs,31,$8.45 
Lattafa,Lattafa Qaa'ed Al Fursan Unlimited Edp 100ml Spy,6291108739020,1 Pcs,31,$8.45 
Lattafa,Lattafa Qaa'ed Al Shabaab Air Freshner 300ml Spy,6291108738962,12 Pcs,6,$1.64 
Lattafa,Lattafa Qaa'ed Al Shabaab Edp 100ml Spy,6291108733806,11 Pcs,45,$12.27 
Lattafa,Lattafa Qaa'ed Edp 100ml Spy,6291107450414,78 Pcs,45,$12.27 
Lattafa,Lattafa Qasaed Al Sultan Edp 100ml Spy,6291108737958,12 Pcs,24,$6.54 
Lattafa,Lattafa Qimmah M Edp 100ml Spy,6291107450582,3 Pcs,34,$9.27 
Lattafa,Lattafa Ra'ed Luxe Gold Air Freshner 300ml Spy,6291108735183,1 Pcs,6,$1.64 
Lattafa,Lattafa Raghba Air Freshner 300ml Spy,6291106067415,10 Pcs,6,$1.64 
Lattafa,Lattafa Raghba Edp 100ml+50ml Deo Spy,6225709773235,37 Pcs,31,$8.45 
Lattafa,Lattafa Raghba Edp 30ml Spy,6291108731222,6 Pcs,14,$3.82 
Lattafa,Lattafa Raghba for Man L.E. Edp 100ml+50ml Deo.Spy,6291106060065`,5 Pcs,32,$8.73 
Lattafa,Lattafa Raghba Wood Intense Edp 100ml Spy,6291106064070,38 Pcs,30,$8.18 
Lattafa,Lattafa Ramaad Al Oud Edp 100ml Spy,6291107457062,6 Pcs,38,$10.36 
Lattafa,Lattafa Ramz Lattafa Gold Air Freshner 300ml Spy,6291108735190,3 Pcs,6,$1.64 
Lattafa,Lattafa Ramz Lattafa Gold Edp 100ml Spy,6291106066715,8 Pcs,34,$9.27 
Lattafa,Lattafa Ramz Lattafa Silver Air Freshner 300ml Spy,6291108735206,3 Pcs,6,$1.64 
Lattafa,Lattafa Ramz Lattafa Silver Edp 100ml Spy,6291106066722,39 Pcs,34,$9.27 
Lattafa,Lattafa Rave Now Edp 100ml Spy,6291107456485,70 Pcs,39,$10.64 
Lattafa,Lattafa Rave Now White Edp 100ml Spy,6290360590349,35 Pcs,39,$10.64 
Lattafa,Lattafa Rave Now Woman (Pink) Edp 100ml Spy,6290360593685,11 Pcs,40,$10.91 
Lattafa,Lattafa Rouat Al Oud Edp 100ml Spy,6291106064841,11 Pcs,40,$10.91 
Lattafa,Lattafa Sakeena Edp 100ml Spy,6291108738481,25 Pcs,64,$17.45 
Lattafa,Lattafa Sha'ari Edp 100ml Spy,6291107454054,1 Pcs,29,$7.91 
Lattafa,Lattafa Sheikh Al Shuyuk Final Edition Edp 100ml Spy,6291107459738,9 Pcs,32,$8.73 
Lattafa,Lattafa Sheikh Al Shuyukh Air Freshner 300ml Spy,6158506068698,12 Pcs,6,$1.64 
Lattafa,Lattafa Sheikh Al Shuyukh Edp 50ml+50ml Deo.Spy,6479211627964`,21 Pcs,30,$8.18 
Lattafa,Lattafa Sheikh Al Shuyukh Luxe Edition Air Freshner 300ml,6291106067422,12 Pcs,6,$1.64 
Lattafa,Lattafa Sheikh Al Shuyukh Luxe Edition Edp 100ml Spy,6291106063981,1 Pcs,33,$9.00 
Lattafa,Lattafa Suqraat Edp 100ml Spy,6291108732045,78 Pcs,38,$10.36 
Lattafa,Lattafa Thuraya Edp 100ml Spy,6291108730621,48 Pcs,28,$7.64 
Lattafa,Lattafa Velvet Oud Edp 100ml Spy,6291106069525,32 Pcs,46,$12.54 
Lattafa,Lattafa Velvet Rose Edp 100ml Spy,6291108737101,8 Pcs,45,$12.27 
Lattafa,Lattafa Washwashah Edp 100ml+50ml Deo Spy,6456874097129,38 Pcs,30,$8.18 
Lattafa,Lattafa Yara Air Freshener 300ml Spy,6291108735213,33 Pcs,6.6,$1.80 
Lattafa,Lattafa Yara Moi White Edp 100ml Spy,6290360591421,1 Pcs,48,$13.09 
Lattafa,Lattafa Yara (Pink) 200ml Deo Spy,,120 Pcs,6.6,$1.80 
Lattafa,Lattafa Yara (Pink) Edp 100ml Spy,6291108730515,120 Pcs,48,$13.09 
Lattafa,Lattafa Yara (Pink) Hair Mist 50ml Spy,6291108735404,54 Pcs,22,$6.00 
Lattafa,Lattafa Yara Tous Edp 100ml Spy,6290360594552,67 Pcs,48,$13.09 
LC Perfumes,Goodies Edp 80ml Spy,6297000426266,120 Pcs,55,$15.00 
LC Perfumes,LC. HSK the Jacket Edp 100ml Spy,6228468264787,11 Pcs,44,$12.00 
LC Perfumes,LC. Oud and Saffron Int. Ext. De Perfume 100ml Spy,6297000426853,9 Pcs,65,$17.73 
LC Perfumes,LC. Oud Tiger Intense Ext. De Perfume 100ml Spy,6297000426860,11 Pcs,65,$17.73 
LC Perfumes,LC. Polo Di Blanc Edp 100ml Spy,62977000426334,12 Pcs,40,$10.91 
LC Perfumes,LC. Tippu Sultan Edp 100ml Spy,6297000426006,6 Pcs,40,$10.91 
Le Labo,Le Labo Bergamote 22 Edp 100ml Spy,811901022912,6 Pcs,660,$179.98 
Le Labo,Le Labo Rose 31 Edp 100ml Spy,811901023001,11 Pcs,660,$179.98 
Lolita Lempicka,Lolita Lempicka W Edp 100ml Spy,3760269849303,20 Pcs,118,$32.18 
Louis Vuitton,Louis Vuitton Mille Feux Edp 100ml Spy,3701002700055,1 Pcs,"1,200.00",$327.24 
Luxodor,Luxodor Anisa Edp 30ml Spy,6295842515834,6 Pcs,33,$9.00 
Luxodor,Luxodor Gypsy Blood Parfum 30ml Spy,6295842515827,5 Pcs,33,$9.00 
Luxodor,Luxodor Gyrfalcon the White Phase Edp 30ml Spy,6295858581205,1 Pcs,33,$9.00 
Luxodor,Luxodor Ottoman Shahzada Edp 30ml Spy,6295858858123,5 Pcs,33,$9.00 
Luxodor,Luxodor Prince Edp 30ml Spy,6295855855125,8 Pcs,33,$9.00 
Luxodor,Luxodor Prince Edp 80ml Spy,6200068201966,10 Pcs,61,$16.63 
Luxodor,Luxodor Shogun Edp 100ml Spy,6292952653357,1 Pcs,61,$16.63 
Luxodor,Luxodor the Bandit Edp 100ml Spy,6292000074219,9 Pcs,61,$16.63 
Luxodor,Luxodor the Wild Edp 100ml Spy,6297485187126,11 Pcs,61,$16.63 
M.Micallef,M.Micallef Ananda Pure Hand Gel 60ml,3760231059822,14 Pcs,6,$1.64 
M.Micallef,M.Micallef Ananda Pure Hand Sanitizer 200ml,3760231059839,13 Pcs,15,$4.09 
Madison Perfumes,Puccini Black Pearl Edp 100ml Tester,,5 Pcs,25,$6.82 
Madison Perfumes,Puccino Lovely Night Edp 100ml Tester,,2 Pcs,25,$6.82 
Maison Alhambra,Maison Alhambra Baroque La Rouge Edp 100ml Spy,6291107459141,34 Pcs,34,$9.27 
Maison Alhambra,Maison Alhambra Baroque Rouge Extrait Edp 100ml Spy,6291108736067,9 Pcs,37,$10.09 
Maison Alhambra,Maison Alhambra Como Moiselle Edp 100ml Spy,6291108730089,2 Pcs,30,$8.18 
Maison Alhambra,Maison Alhambra Encode Blue Edp 100ml Spy,6291108735923,7 Pcs,30,$8.18 
Maison Alhambra,Maison Alhambra Expose Blanc Edp 100ml Spy,6291108736333,19 Pcs,33,$9.00 
Maison Alhambra,Maison Alhambra Expose Intense Edp 100ml Spy,6291108736326,15 Pcs,33,$9.00 
Maison Alhambra,Maison Alhambra Florence Edp 100ml Spy,6291107459202,13 Pcs,29,$7.91 
Maison Alhambra,Maison Alhambra Hercules Edp 100ml Spy,6291107459233,5 Pcs,30,$8.18 
Maison Alhambra,Maison Alhambra Kismet Magic Edp 100ml Spy,6291108736579,41 Pcs,55,$15.00 
Maison Alhambra,Maison Alhambra Kismet M Edp 100ml Spy,6291107459257,34 Pcs,52,$14.18 
Maison Alhambra,Maison Alhambra L'intrude Edp 100ml Spy,6291108730171,41 Pcs,30,$8.18 
Maison Alhambra,Maison Alhambra La Vita Bella Edp 100ml Spy,6291108730188,22 Pcs,30,$8.18 
Maison Alhambra,Maison Alhambra La Voie Edp 100ml Spy,6291108735961,1 Pcs,30,$8.18 
Maison Alhambra,Maison Alhambra Leonie Edp 100ml Spy,6291108730195,11 Pcs,30,$8.18 
Maison Alhambra,Maison Alhambra Perseus Edp 100ml Spy,6291107459318,3 Pcs,30,$8.18 
Maison Alhambra,Maison Alhambra Philos Pura Edp 100ml Spy,6291107459349,1 Pcs,36,$9.82 
Maison Alhambra,Maison Alhambra Rose Petals Edp 80ml Spy,6291108735749,3 Pcs,40,$10.91 
Maison Alhambra,Maison Alhambra Salvo Edp 100ml Spy,6291107459363,12 Pcs,30,$8.18 
Maison Alhambra,Maison Alhambra Terra Edp 50ml Spy,6291108735473,6 Pcs,75,$20.45 
Maison Alhambra,Maison Alhambra the Artist No.1 Edp 100ml Spy,6291108735725,12 Pcs,52,$14.18 
Maison Alhambra,Maison Alhambra Verona W Edp 100ml Spy,6291108737071,95 Pcs,33,$9.00 
Maison Alhambra,Maison Alhambra Yeah! Edp 100ml Spy,6291108730324,13 Pcs,33,$9.00 
Maison Francis Kurkdjian,MFK Baccarat Rouge 540 Edp 200ml Spy,3700559605417,6 Pcs,"1,450.00",$395.42 
Maison Francis Kurkdjian,MFK Baccarat Rouge 540 Edp 70ml Spy,3700559603116,8 Pcs,850,$231.80 
Maison Francis Kurkdjian,MFK Baccarat Rouge 540 Extrait De Parfum 200ml Spy,3700559609170,3 Pcs,"2,250.00",$613.58 
Maison Francis Kurkdjian,MFK Baccarat Rouge 540 Extrait De Parfum 70ml Spy,3700559605905,12 Pcs,"1,250.00",$340.88 
Maison Francis Kurkdjian,MFK Oud Extrait De Parfum 70ml Spy,3700559606506,5 Pcs,"1,210.00",$329.97 
Maison Francis Kurkdjian,MFK Oud Satin Mood Edp 70ml Spy,3700559602607,2 Pcs,825,$224.98 
Maison Francis Kurkdjian,MFK Oud Satin Mood Extrait De Parfum 70ml Spy,3700559605448,4 Pcs,"1,180.00",$321.79 
Maison Margiela,MM Replica Jazz Club Edt 100ml Spy,3605521932105,8 Pcs,275,$74.99 
Mancera,Mancera Aoud Cafe` Edp 120ml Spy,3760265190126,1 Pcs,205,$55.90 
Mancera,Mancera Aoud Violet Edp 120ml Spy`,,5 Pcs,165,$45.00 
Mancera,Mancera Black to Black Edp 120ml Tester,,6 Pcs,150,$40.91 
Mancera,Mancera Cedrat Boise Intense EXP 120ml Spy`,,12 Pcs,215,$58.63 
Mancera,Mancera Deep Forest Edp 120ml Tester,,1 Pcs,150,$40.91 
Mancera,Mancera Gold Aoud Edp 120ml Spy`,,3 Pcs,165,$45.00 
Mancera,Mancera Holiday Edp 120ml Spy,3760265191659,2 Pcs,205,$55.90 
Mancera,Mancera Instant Crush Edp 120ml Spy`,,20 Pcs,205,$55.90 
Mancera,Mancera Midnight Gold Edp 120ml Spy`,,6 Pcs,180,$49.09 
Mancera,Mancera Musk of Flowers Edp 120ml Spy`,,6 Pcs,180,$49.09 
Mancera,Mancera Musky Garden Edp 120ml Tester,,8 Pcs,165,$45.00 
Mancera,Mancera Red Tobacco Edp 120ml Spy,3760265191864,9 Pcs,275,$74.99 
Mancera,Mancera Red Tobacco Edp 120ml Spy`,,18 Pcs,275,$74.99 
Mancera,Mancera Red Tobacco Intense Edp 120ml Spy,3760265194513,118 Pcs,295,$80.45 
Mancera,Mancera Roses Greedy Edp 120ml Spy`,,66 Pcs,165,$45.00 
Mancera,Mancera Roses Vanille Edp 120ml Spy`,,23 Pcs,180,$49.09 
Mancera,Mancera Roses Vanille Edp 120ml Tester,,2 Pcs,150,$40.91 
Mancera,Mancera Tonka Cola Edp 120ml Spy,,38 Pcs,220,$59.99 
Mandarina Duck,Mandarina Duck Scarlet Rain Edt 100ml Spy,8427395830203,48 Pcs,45,$12.27 
Marbert,Marbert Homme Edt 100ml Spy,4085404560042,10 Pcs,34,$9.27 
Marbert,Marbet Man Pure Edt 125ml Spy,4085400381016,104 Pcs,41,$11.18 
Marc Jacobs,Marc Jacobs Daisy Love 30ml Body Lotion (650017),,29 Pcs,10,$2.73 
Marc-Antoine,Marc-Antoine Barrois Ganymede Edp 100ml Spy,3770006409028,2 Pcs,630,$171.80 
Marina De Bourbon,MDB Bleu Royal Edp 100ml Spy,3494800370031,120 Pcs,55,$15.00 
Marina De Bourbon,MDB Bleu Royal Edp 30ml Spy,3494800370048,120 Pcs,30,$8.18 
Marina De Bourbon,MDB Dynastie Edp 100ml Tester,,66 Pcs,42,$11.45 
Marina De Bourbon,MDB Dynastie Edp 30ml Spy,3494800120049,18 Pcs,30,$8.18 
Marina De Bourbon,MDB Paradise Lys Edp 30ml Spy,3494800500049,120 Pcs,30,$8.18 
Marina De Bourbon,MDB Paradise Lys Edp 50ml Spy,3494800500025,7 Pcs,42,$11.45 
Marina De Bourbon,MDB Paradise Lys Edp 50ml Tester,,18 Pcs,30,$8.18 
Marina De Bourbon,MDB Pink Princesse Edp 100ml Spy,3494800400035,61 Pcs,55,$15.00 
Marina De Bourbon,MDB Pink Princesse Edp 30ml Spy,3494800400042,120 Pcs,30,$8.18 
Marina De Bourbon,MDB Pink Princesse Edp 50ml Spy,3494800400028,8 Pcs,42,$11.45 
Mauboussin,Mauboussin Ala Folie Edp 100ml Spy,3760048795340,25 Pcs,66,$18.00 
Mauboussin,Mauboussin Crystal Oud Edp 100ml Spy,3760048796392,15 Pcs,66,$18.00 
Mauboussin,Mauboussin Discovery Edp 100ml Spy,3760048796927,26 Pcs,66,$18.00 
Mauboussin,Mauboussin In Red Edp 100ml Spy,3760048796798,10 Pcs,75,$20.45 
Mauboussin,Mauboussin Mademoiselle Twist Edp 90ml Spy,3760048796637,25 Pcs,66,$18.00 
Mauboussin,Mauboussin Pour Elle Edp 100ml Spy,3760048791854,24 Pcs,75,$20.45 
Mauboussin,Mauboussin Pour Elle Edp 100ml Unbox Tester,,6 Pcs,50,$13.64 
Mauboussin,Mauboussin Pour Elle Elixir Edp 100ml Spy,3760048794824,27 Pcs,75,$20.45 
Mauboussin,Mauboussin Pour Elle Elixir Hair Mist 30ml Spy,3760048797016,5 Pcs,39,$10.64 
Mauboussin,Mauboussin Pour Homme Edp 100ml Spy,3760048796118,34 Pcs,66,$18.00 
Mauboussin,Mauboussin Pour Lui Edp 100ml Spy,3760048792851,29 Pcs,66,$18.00 
Mauboussin,Mauboussin Pour Lui Edp 100ml Unbox Tester,,3 Pcs,44,$12.00 
Mauboussin,Mauboussin Pour Lui In Black Edp 100ml Spy,3760048795548,21 Pcs,66,$18.00 
Mauboussin,Mauboussin Pour Lui In Black Edp 100ml Unbox Tester,,3 Pcs,44,$12.00 
Mauboussin,Mauboussin Private Club Pour Homme Edp 100ml Spy,3760048796552,22 Pcs,66,$18.00 
Mauboussin,Mauboussin Promise Me Edp 90ml Spy,3760048795661,10 Pcs,66,$18.00 
Mauboussin,Mauboussin Promise Me Intense Edp 90ml Spy,3760048796132,13 Pcs,66,$18.00 
Mauboussin,Mauboussin Une Histoire D'homme Irresitible Edp 90ml Spy,3760048796910,25 Pcs,66,$18.00 
Mauboussin,Mauboussin W (Purple) Edp 100ml Spy,3760048796101,12 Pcs,66,$18.00 
Mawaz,Mawaz Aromatique Epice Edp 100ml Spy,3606880889567,120 Pcs,92,$25.09 
Mawaz,Mawaz Be Free Edp 100ml Spy,3606880996678,92 Pcs,45,$12.27 
Mawaz,Mawaz Black Rose Intense Edp 100ml Spy,3606880889864,99 Pcs,77,$21.00 
Mawaz,Mawaz Eau Fraiche Paris Edp 65ml Spy,3606880889550,120 Pcs,92,$25.09 
Mawaz,Mawaz Fleur De Nuit Edp 100ml Spy,3606880889659,98 Pcs,92,$25.09 
Mawaz,Mawaz Floral Fort Edp 50ml Spy,3606880996616,120 Pcs,60,$16.36 
Mawaz,Mawaz Le Cercle Rose Edp 80ml Spy,3606880996630,120 Pcs,92,$25.09 
Mawaz,Mawaz Le Smoke Oud Edp 80ml Spy,3606880996647,95 Pcs,92,$25.09 
Mawaz,Mawaz Le Tabac Rouge Edp 100ml Spy,3606880889352,120 Pcs,77,$21.00 
Mawaz,Mawaz Notte De Ambre Edp 100ml Spy,3606880996654,14 Pcs,45,$12.27 
Mawaz,Mawaz Oud 20 Edp 100ml Spy,3606880996661,120 Pcs,45,$12.27 
Mawaz,Mawaz Saffron Oud Edp 50ml Spy,3606880996623,120 Pcs,60,$16.36 
Maxi,Just Call Me Maxi Edc 100ml Spy,5011321830356,12 Pcs,29,$7.91 
Memo,Memo African Leather Edp 75ml Spy,3700458602999,1 Pcs,405,$110.44 
Memo,Memo Flem Edp 75ml Tester,,7 Pcs,275,$74.99 
Memo,Memo Irish Leather Edp 75ml Spy,3700458602982,60 Pcs,395,$107.72 
Memo,Memo Irish Leather Edp 75ml Tester,3700458612516,1 Pcs,295,$80.45 
Memo,Memo Irish Leather Hair Perfume 80ml Spy,3700458600247,33 Pcs,135,$36.81 
Memo,Memo Ocean Leather Edp 75ml Spy,3700458601770,1 Pcs,425,$115.90 
Memo,Memo Oriental Leather Edp 75ml Tester,,3 Pcs,275,$74.99 
Memo,Memo Russian Leather Edp 75ml Tester,,1 Pcs,275,$74.99 
Memo,Memo Sicilian Leather Edp 75ml Tester,,10 Pcs,275,$74.99 
Mercedes- Benz,Mercedes Benz Club Extreme M Edt 100ml Spy,3595471101273,89 Pcs,86,$23.45 
Mercedes- Benz,Mercedes Benz Club M Edt 100ml Spy,3595471041012,26 Pcs,93,$25.36 
Mercedes- Benz,Mercedes Benz Fanciful Edition W Nail Lacquer,,13 Pcs,33,$9.00 
Mercedes- Benz,Mercedes Benz Fancifull Edition W Edt 60ml Spy,3595471085153,12 Pcs,85,$23.18 
Mercedes- Benz,Mercedes Benz Fancifull Edition W Edt 90ml Spy,3595471026781,12 Pcs,115,$31.36 
Mercedes- Benz,Mercedes Benz Fancifull Edition W Edt 90ml Tester,3595471026798,12 Pcs,85,$23.18 
Mercedes- Benz,Mercedes Benz for Man 200ml Body Spy,3595471021960,25 Pcs,22,$6.00 
Mercedes- Benz,Mercedes Benz Intense M Edt 100ml Tester,3595471062109,6 Pcs,75,$20.45 
Mercedes- Benz,Mercedes Benz Intense M Edt 120ml Spy,3595471024787,5 Pcs,115,$31.36 
Mercedes- Benz,Mercedes Benz Intense M Edt 120ml Tester,3595471024794,1 Pcs,75,$20.45 
Mercedes- Benz,Mercedes Benz Intense Men 200ml Body Spy,3595471022790,6 Pcs,22,$6.00 
Mercedes- Benz,Mercedes Benz Le Perfume M Edp 120ml Spy,3595471021182,2 Pcs,125,$34.09 
Mercedes- Benz,Mercedes Benz Man Bright Edp 100ml+100SG Set,3595471023889,10 Pcs,115,$31.36 
Mercedes- Benz,Mercedes Benz Man Bright Edp 100ml Spy,3595472061262,12 Pcs,110,$30.00 
Mercedes- Benz,Mercedes Benz Man Bright Edp 100ml Tester,3595472062238,6 Pcs,75,$20.45 
Mercedes- Benz,Mercedes Benz Man Edt 100ml+75g Deo.Stick Set,3595471023766,8 Pcs,110,$30.00 
Mercedes- Benz,Mercedes Benz Man Edt 100ml Tester,3595471062017,6 Pcs,75,$20.45 
Mercedes- Benz,Mercedes Benz Man Edt 200ml Spy,3595472061286,5 Pcs,130,$35.45 
Mercedes- Benz,Mercedes Benz Man Edt 50ml Spy,3595471061027,9 Pcs,75,$20.45 
Mercedes- Benz,Mercedes Benz M Edt 120ml Tester,3595471024749,5 Pcs,75,$20.45 
Mercedes- Benz,Mercedes Benz Move Express Yourself Edt 100ml Spy,3595471091031,8 Pcs,105,$28.63 
