Parent,Item,BARCODE,Closing,PRICE_AED, Prices us
Accendis,Accendis Florialux Edp 100ml Spy,8054521910142,1 Pcs,165,$45.00 
Accendis,Accendis Lucepura Edp 100ml Spy,8054521910098,5 Pcs,165,$45.00 
Afnan,Afnan 9am Edp 100ml Spy,6290171002345,120 Pcs,75,$20.45 
Afnan,Afnan 9am Pour Femme Edp 100ml Spy,6290171072591,15 Pcs,80,$21.82 
Afnan,Afnan 9pm Edp 100ml Spy,6290171002338,120 Pcs,75,$20.45 
Afnan,Afnan 9pm Pour Femme Edp 100ml Spy,6290171072607,120 Pcs,80,$21.82 
Afnan,Afnan Adwaa Al Sharq Concentrated Perfume Oil 25ml,6290171002307,39 Pcs,29,$7.91 
Afnan,Afnan Arabian Gems Edp 100ml Spy,6290171001218,12 Pcs,30,$8.18 
Afnan,Afnan Dehn Al Oudh Abiyad Concentrated Perfume Oil 20ml,6290171000129,120 Pcs,25,$6.82 
Afnan,Afnan Fakhr Al Jamaal Concentrated Perfume Oil 20ml,6290171000518,101 Pcs,25,$6.82 
Afnan,Afnan Highness III Edp 100ml Spy,6290171002246,3 Pcs,165,$45.00 
Afnan,Afnan Highness X Edp 100ml Spy,6290171070177,3 Pcs,165,$45.00 
Afnan,Afnan Historic Doria Edp 100ml Spy,6290171071136,57 Pcs,115,$31.36 
Afnan,Afnan Historic Olmeda Edp 100ml Spy,6290171071143,57 Pcs,115,$31.36 
Afnan,Afnan La Fleur Bouquet Edp 80ml Spy,6290171070184,114 Pcs,85,$23.18 
Afnan,Afnan Mukhallat Abiyad Concentrated Perfume Oil 20ml,6290171000082,120 Pcs,25,$6.82 
Afnan,Afnan Musk Abiyad Concentrated Perfume Oil 20ml,6290171001058,117 Pcs,25,$6.82 
Afnan,Afnan Mystique Bouquet Edp 80ml Spy,6290171073840,12 Pcs,95,$25.91 
Afnan,Afnan Patchouli on Fire Edp 80ml Spy,6290171071525,101 Pcs,125,$34.09 
Afnan,Afnan Pure Musk Edp 100ml Spy,6290171002130,16 Pcs,39,$10.64 
Afnan,Afnan Rare Carbon Edp 100ml Spy,6290171002291,31 Pcs,70,$19.09 
Afnan,Afnan Rare Tiffany Edp 100ml Spy,6290171002284,17 Pcs,66,$18.00 
Afnan,Afnan Souvenir Desert Rose Edp 100ml Spy,6290171040637,89 Pcs,85,$23.18 
Afnan,Afnan Supremacy In Oud EXP 100ml Spy,6290171070207,21 Pcs,140,$38.18 
Afnan,Afnan Supremacy Noir Edp 100ml Spy,6290171001614,11 Pcs,85,$23.18 
Afnan,Afnan Supremacy Not Only Intense EXP 100ml Spy,6290171070214,38 Pcs,140,$38.18 
Afnan,Afnan Supremacy Pink Edp 100ml Spy,6290171002048,37 Pcs,85,$23.18 
Afnan,Afnan Supremacy Purple Edp 100ml Spy,6290171002055,48 Pcs,85,$23.18 
Afnan,Afnan Supremacy Silver 250ml Perfume Body Spy,6290171002352,96 Pcs,12,$3.27 
Afnan,Afnan Supremacy Silver Edp 100ml Spy,6290171000976,120 Pcs,85,$23.18 
Afnan,Afnan Tobacco Rush Edp 80ml Spy,6290171071518,120 Pcs,125,$34.09 
Afnan,Afnan Tribute Pink Edp 100ml Spy,6290171070337,3 Pcs,140,$38.18 
Afnan,Afnan Turathi Brown Edp 90ml Spy,6290171070603,14 Pcs,85,$23.18 
Afnan,Afnan Turathi Purple Edp 90ml Spy,6290171070573,45 Pcs,85,$23.18 
Afnan,Afnan Turathi Red Edp 90ml Spy,6290171070597,44 Pcs,85,$23.18 
Ahmed Al Maghrebi,Ahmed Al Maghribi Kaaf Edp 100ml Spy,6290360610498,3 Pcs,62,$16.91 
Ahmed Al Maghrebi,Ahmed Al Maghribi Oud & Roses Edp 60ml Spy,6290360610009,2 Pcs,126,$34.36 
Ahmed Al Maghrebi,Ahmed Al Maghribi Perfumes Bin Shaikh Edp 90ml Spy,2640900013496,5 Pcs,180,$49.09 
Ahmed Al Maghrebi,Ahmed Al Maghribi Perfumes Little Hearts Edp 50ml Spy,2640500012721,6 Pcs,45,$12.27 
Ajmal,Ajmal 1001 Night Edp 60ml Spy,6293708000227,26 Pcs,96,$26.18 
Ajmal,Ajmal 1001 Nights Concentrated Perfume Oil 30ml,6293708000203,8 Pcs,155,$42.27 
Ajmal,Ajmal Aatifa 200ml Deo.Spy,6293708010332,89 Pcs,11,$3.00 
Ajmal,Ajmal Alia W Edp 75ml Spy,6293708008667,11 Pcs,75,$20.45 
Ajmal,Ajmal Amaze Her Edp 75ml Spy,6293708015634,16 Pcs,66,$18.00 
Ajmal,Ajmal Amaze Him Edp 100ml Spy,6293708015627,17 Pcs,66,$18.00 
Ajmal,Ajmal Amber Leather Edp 100ml Spy,6293708018703,27 Pcs,275,$74.99 
Ajmal,Ajmal Amber Musc Edp 100ml Spy,6293708007486,10 Pcs,185,$50.45 
Ajmal,Ajmal Amber Santal Edp 100ml Spy,6293708012688,23 Pcs,220,$59.99 
Ajmal,Ajmal Amber Santal Hair Mist 100ml Spy,6293708014620,11 Pcs,55,$15.00 
Ajmal,Ajmal Amber Wood Edp 100ml Spy,6293708006731,120 Pcs,285,$77.72 
Ajmal,Ajmal Amber Wood Edp 50ml Spy,6293708016556,120 Pcs,180,$49.09 
Ajmal,Ajmal Amber Wood Hair Mist 100ml Spy,6293708014156,61 Pcs,55,$15.00 
Ajmal,Ajmal Amber Wood Noir Edp 100ml Spy,6293708013968,64 Pcs,275,$74.99 
Ajmal,Ajmal Amber Wood Noir Edp 50ml Spy,6293708016532,14 Pcs,180,$49.09 
Ajmal,Ajmal Amber Zest Edp 100ml Spy,6293708019441,11 Pcs,60,$16.36 
Ajmal,Ajmal Ambre Pimente M Edp 100ml Spy,6293708008193,120 Pcs,60,$16.36 
Ajmal,Ajmal Amir One Edp 50ml Spy,6293708016495,5 Pcs,345,$94.08 
Ajmal,Ajmal Amir Two Edp 50ml Spy,6293708016501,19 Pcs,345,$94.08 
Ajmal,Ajmal Aristocrat Coastal M Edp 75ml Spy,6293708019601,50 Pcs,158,$43.09 
Ajmal,Ajmal Aristocrat Coral W Edp 75ml Spy,6293708019595,50 Pcs,158,$43.09 
Ajmal,Ajmal Aristocrat M 200ml Deo.Spy,6293708014767,120 Pcs,11,$3.00 
Ajmal,Ajmal Aristocrat M Edp 75ml Spy,6293708010233,120 Pcs,110,$30.00 
Ajmal,Ajmal Aristocrat Platinum Edp 75ml Spy,6293708014606,101 Pcs,110,$30.00 
Ajmal,Ajmal Aristocrat W Edp 75ml Spy,6293708011124,120 Pcs,110,$30.00 
Ajmal,Ajmal Aurum Edp 75ml+200SG+200BB+100BP Set,6293708005772,2 Pcs,147,$40.09 
Ajmal,Ajmal Aurum Edp 75ml Spy,6293708004867,120 Pcs,88,$24.00 
Ajmal,Ajmal Aurum Summer Edp 75ml Spy,9293708013692,12 Pcs,70,$19.09 
Ajmal,Ajmal Aurum W 200ml Deo.Spy,6293708006922,88 Pcs,11,$3.00 
Ajmal,Ajmal Aurum Winter Edp 75ml Spy,6293708013036,19 Pcs,70,$19.09 
Ajmal,Ajmal Avid M 200ml Deo.Spy,6293708010394,88 Pcs,10,$2.73 
Ajmal,Ajmal Black Onyx M Edp 100ml Spy,6293708009732,9 Pcs,55,$15.00 
Ajmal,Ajmal Blu Femme Edp 50ml Spy,6293708009398,70 Pcs,44,$12.00 
Ajmal,Ajmal Blu M 200ml Deo.Spy,6293708007684,120 Pcs,10,$2.73 
Ajmal,Ajmal Blu M Edp 90ml Spy,6293708006106,120 Pcs,60,$16.36 
Ajmal,Ajmal Carbon M 200ml Deo.Spy,6293708006885,80 Pcs,10,$2.73 
Ajmal,Ajmal Carbon M Edp 100ml Spy,6293708000425,120 Pcs,33,$9.00 
Ajmal,Ajmal Cashmere Musc Edp 100ml Spy,6293708012213,18 Pcs,185,$50.45 
Ajmal,Ajmal Cashmere Musc Hair Mist 100ml Spy,6293708017188,3 Pcs,55,$15.00 
Ajmal,Ajmal Centuria Edp 100ml Spy,6293708019786,11 Pcs,44,$12.00 
Ajmal,Ajmal Cerise W 200ml Deo.Spy,6293708008865,90 Pcs,10,$2.73 
Ajmal,Ajmal Cerise W Edp 75ml Spy,6293708007356,104 Pcs,66,$18.00 
Ajmal,Ajmal Chemystery W Edp 90ml Spy,6293708000432,35 Pcs,50,$13.64 
Ajmal,Ajmal Chivalry M Edp 100ml Spy,6293708011490,12 Pcs,29,$7.91 
Ajmal,Ajmal Cool Moon Perfume Oil 12ml,6293704009804,80 Pcs,20,$5.45 
Ajmal,Ajmal Cuir Musc Edp 100ml Spy,6293708007479,17 Pcs,185,$50.45 
Ajmal,Ajmal Danat Al Duniya Edp 60ml Spy,6293708000746,5 Pcs,52,$14.18 
Ajmal,Ajmal Dawn M Edp 90ml Spy,6293708011179,3 Pcs,66,$18.00 
Ajmal,Ajmal Elixir Intense Edp 100ml Spy,6293708014101,45 Pcs,275,$74.99 
Ajmal,Ajmal Elixir Precious Edp 100ml Spy,6293708013944,13 Pcs,275,$74.99 
Ajmal,Ajmal Elixir Suave Edp 100ml Spy,6293708013951,13 Pcs,275,$74.99 
Ajmal,Ajmal Entics Pour Femme Edp 75ml Spy,6293708004065,36 Pcs,52,$14.18 
Ajmal,Ajmal Enya Edp 100ml Spy,6293708018697,24 Pcs,44,$12.00 
Ajmal,Ajmal Essential Him Edp 20ml+Her Edp 20ml Spy,6293708302130,73 Pcs,20,$5.45 
Ajmal,Ajmal Eternal No.23 Edp 100ml Spy,6293708014828,1 Pcs,275,$74.99 
Ajmal,Ajmal Evoke Gold Edition W Edp 75ml Spy,6293708011278,72 Pcs,85,$23.18 
Ajmal,Ajmal Evoke Her Edp 75ml Spy,6293708004973,2 Pcs,70,$19.09 
Ajmal,Ajmal Evoke Him Edp 90ml Spy,6293708004980,54 Pcs,70,$19.09 
Ajmal,Ajmal Evoke Midnight Edition M Edp 90ml Spy,6293708017485,26 Pcs,70,$19.09 
Ajmal,Ajmal Evoke Midnight Edition W Edp 75ml Spy,6293708019502,24 Pcs,85,$23.18 
Ajmal,Ajmal Evoke Silver Edition M 200ml Deo.Spy,6293708010370,81 Pcs,10,$2.73 
Ajmal,Ajmal Evoke Silver Edition M Edp 90ml Spy,6293708008926,17 Pcs,60,$16.36 
Ajmal,Ajmal Evoke Silver Edition W Edp 75ml Spy,6293708009145,15 Pcs,60,$16.36 
Ajmal,Ajmal Expedition M Edp 100ml Spy,6293708014446,10 Pcs,30,$8.18 
Ajmal,Ajmal Exquisite Essence Edp 100ml Spy,6293708019540,24 Pcs,185,$50.45 
Ajmal,Ajmal Extra Pure Perfume Oil 12ml,6293704010305,81 Pcs,20,$5.45 
Ajmal,Ajmal Fantabulous Perfume Oil 12ml,6293704009811,82 Pcs,23,$6.27 
Ajmal,Ajmal Fantabulous W Edp 75ml Spy,6293708009886,8 Pcs,62,$16.91 
Ajmal,Ajmal Free Spirit M Edp 100ml Spy,6293708011506,37 Pcs,29,$7.91 
Ajmal,Ajmal Gold Man Edp 100ml Spy,6293708011513,31 Pcs,29,$7.91 
Ajmal,Ajmal Gray M Edp 100ml Spy,6293708015344,49 Pcs,44,$12.00 
Ajmal,Ajmal Happy Musk Perfume Oil 12ml,6293704013313,84 Pcs,26,$7.09 
Ajmal,Ajmal Hatkora Wood Edp 100ml Spy,6293708006748,29 Pcs,265,$72.27 
Ajmal,Ajmal Hatkora Wood Edp 50ml Spy,6293708016549,13 Pcs,170,$46.36 
Ajmal,Ajmal Hayba Edp 80ml Spy,6293708012190,13 Pcs,60,$16.36 
Ajmal,Ajmal Incense Wood Edp 100ml Spy,6293708012220,18 Pcs,265,$72.27 
Ajmal,Ajmal Kuro M Edp 90ml Spy,6293708008049,120 Pcs,60,$16.36 
Ajmal,Ajmal Magnifica Edp 100ml Spy,6293708016266,9 Pcs,29,$7.91 
Ajmal,Ajmal Majestica Edp 100ml Spy,6293708016273,9 Pcs,29,$7.91 
Ajmal,Ajmal Majestic Melange Edp 100ml Spy,6293708019533,24 Pcs,185,$50.45 
Ajmal,Ajmal Men in Blue Perfume Oil 12ml,6293704009743,84 Pcs,28,$7.64 
Ajmal,Ajmal Million Dollar Perfume Oil 12ml,6293704009781,84 Pcs,29,$7.91 
Ajmal,Ajmal Mizyaan Concentrated Perfume Oil 14ml,6293708001361,13 Pcs,60,$16.36 
Ajmal,Ajmal Moshriqa Edp 50ml Spy,6293708014309,13 Pcs,52,$14.18 
Ajmal,Ajmal Musk Khas Concentrated Perfume Oil 3ml,6293708010943,13 Pcs,44,$12.00 
Ajmal,Ajmal Musk Silk Perfume Oil 12ml,6293704010336,120 Pcs,44,$12.00 
Ajmal,Ajmal My Stellar Edp 100ml Spy,6293708018901,24 Pcs,70,$19.09 
Ajmal,Ajmal Mystery M Edp 100ml Spy,6293708007318,13 Pcs,66,$18.00 
Ajmal,Ajmal My Wonder Edp 85ml Spy,6293708015672,13 Pcs,99,$27.00 
Ajmal,Ajmal Neutron M Edp 100ml Spy,6293708001484,55 Pcs,29,$7.91 
Ajmal,Ajmal Noble Notes Edp 100ml Spy,6293708019557,24 Pcs,185,$50.45 
Ajmal,Ajmal Oath M Edp 100ml Spy,6293708013272,7 Pcs,85,$23.18 
Ajmal,Ajmal Orbiter Edp 100ml Spy,6293708018635,8 Pcs,42,$11.45 
Ajmal,Ajmal Patchouli Wood Edp 100ml Spy,6293708008612,18 Pcs,265,$72.27 
Ajmal,Ajmal Purely Orient Amber Edp 75ml Spy,6293708011001,12 Pcs,250,$68.18 
Ajmal,Ajmal Purely Orient Amber Edp 75ml Tester,6293708106486,1 Pcs,210,$57.27 
Ajmal,Ajmal Purely Orient Cashmere Wood Edp 75ml Spy,6293708011551,11 Pcs,250,$68.18 
Ajmal,Ajmal Purely Orient Cashmere Wood Edp 75ml Tester,6293708106448,1 Pcs,210,$57.27 
Ajmal,Ajmal Purely Orient Patchouli Edp 75ml Spy,6293708010998,12 Pcs,250,$68.18 
Ajmal,Ajmal Purely Orient Patchouli Edp 75ml Tester,6293708106479,1 Pcs,210,$57.27 
Ajmal,Ajmal Purely Orient Saffron Edp 75ml Spy,6293708011575,12 Pcs,250,$68.18 
Ajmal,Ajmal Purely Orient Saffron Edp 75ml Tester,6293708106462,1 Pcs,210,$57.27 
Ajmal,Ajmal Purple Rose Perfume Oil 12ml,6293704009736,84 Pcs,30,$8.18 
Ajmal,Ajmal Qafiya 1 Edp 75ml Spy,6293708008285,2 Pcs,145,$39.54 
Ajmal,Ajmal Qafiya Year of Zayed Edp 75ml Spy,6293708012565,18 Pcs,145,$39.54 
Ajmal,Ajmal Raindrops W 200ml Deo.Spy,6293708006960,76 Pcs,9,$2.45 
Ajmal,Ajmal Raindrops W Edp 50ml Spy,6293708001712,64 Pcs,29,$7.91 
Ajmal,Ajmal Rhythm of Oud Edp 100ml Spy,6293708018000,26 Pcs,150,$40.91 
Ajmal,Ajmal Rose Wood Edp 100ml Spy,6293708007776,13 Pcs,265,$72.27 
Ajmal,Ajmal Sacred Love W 200ml Deo.Spy,6293708006953,90 Pcs,9,$2.45 
Ajmal,Ajmal Sacred Love W Edp 50ml Spy,6293708001798,19 Pcs,33,$9.00 
Ajmal,Ajmal Sacrifice Her 200ml Deo.Spy,6293708006946,82 Pcs,9,$2.45 
Ajmal,Ajmal Sacrifice Her Edp 50ml Spy,6293708002313,1 Pcs,45,$12.27 
Ajmal,Ajmal Sacrifice Him II 200ml Deo.Spy,6293708006915,88 Pcs,9,$2.45 
Ajmal,Ajmal Sacrifice Him II Edp 90ml Spy,6293708004416,8 Pcs,48,$13.09 
Ajmal,Ajmal Santal Wood Edp 100ml Spy,6293708006755,11 Pcs,265,$72.27 
Ajmal,Ajmal Serenity in Me W Edp 100ml Spy,6293708012169,1 Pcs,66,$18.00 
Ajmal,Ajmal Shadow Ice Edp 75ml Spy,6293708018765,19 Pcs,81,$22.09 
Ajmal,Ajmal Shadow II Pour Femme 200ml Deo.Spy,6293708006939,96 Pcs,10,$2.73 
Ajmal,Ajmal Shadow II Pour Femme Edp 75ml Spy,6293708003600,52 Pcs,55,$15.00 
Ajmal,Ajmal Shadow II Pour Homme 200ml Deo.Spy,6293708006878,90 Pcs,10,$2.73 
Ajmal,Ajmal Shadow II Pour Homme Edp 75ml Spy,6293708003549,68 Pcs,55,$15.00 
Ajmal,Ajmal Shadow M Edp 75ml Spy,6293708001910,42 Pcs,55,$15.00 
Ajmal,Ajmal Shadow Noir Edp 75ml Spy,6293708012664,37 Pcs,72,$19.63 
Ajmal,Ajmal Shine W 200ml Deo.Spy,6293708014750,67 Pcs,10,$2.73 
Ajmal,Ajmal Shine W Edp 75ml Spy,6293708009893,57 Pcs,55,$15.00 
Ajmal,Ajmal Shiro M 200ml Deo.Spy,6293708014743,77 Pcs,10,$2.73 
Ajmal,Ajmal Shiro M Edp 90ml Spy,6293708011186,25 Pcs,68,$18.54 
Ajmal,Ajmal Sierra M Edp 90ml Spy,6293708011162,1 Pcs,84,$22.91 
Ajmal,Ajmal Signify W Edp 75ml Spy,6293708008704,2 Pcs,42,$11.45 
Ajmal,Ajmal Silver Shade M 200ml Deo.Spy,6293708006892,78 Pcs,10,$2.73 
Ajmal,Ajmal Silver Shade M Edp 100ml Spy,6293708005352,32 Pcs,41,$11.18 
Ajmal,Ajmal Song of Oud Edp 75ml Spy,6293708018840,27 Pcs,150,$40.91 
Ajmal,Ajmal Sonnet W Edp 100ml Spy,6293708010509,13 Pcs,52,$14.18 
Ajmal,Ajmal Soul of Amir Concentrated Perfume Oil 12ml,6293708019526,7 Pcs,235,$64.09 
Ajmal,Ajmal Titanium M Edp 100ml Spy,6293708002030,11 Pcs,33,$9.00 
Ajmal,Ajmal Verde M Edp 100ml Spy,6293708013227,37 Pcs,37,$10.09 
Ajmal,Ajmal Vibe Her Edp 75ml Spy,6293708017959,27 Pcs,60,$16.36 
Ajmal,Ajmal Vibe Him Edp 75ml Spy,6293708017966,26 Pcs,60,$16.36 
Ajmal,Ajmal Viola W Edp 75ml Spy,6293708009329,111 Pcs,42,$11.45 
Ajmal,Ajmal Violet Musc Edp 100ml Spy,6293708007462,44 Pcs,185,$50.45 
Ajmal,Ajmal Violet Musc Hair Mist 100ml Spy,6293708014163,19 Pcs,55,$15.00 
Ajmal,Ajmal Vision M 200ml Deo.Spy,6293708006908,90 Pcs,9,$2.45 
Ajmal,Ajmal Vision M Edp 100ml Spy,6293708002078,15 Pcs,33,$9.00 
Ajmal,Ajmal Viva Viola W Edp 75ml Spy,6293708010967,33 Pcs,42,$11.45 
Ajmal,Ajmal Wanderer M Edp 100ml Spy,6293708011483,4 Pcs,29,$7.91 
Ajmal,Ajmal Wisal 200ml Deo.Spy,6293708006977,96 Pcs,11,$3.00 
Ajmal,Ajmal Wisal Dhahab 200ml Deo.Spy,6293708007929,120 Pcs,11,$3.00 
Ajmal,Ajmal Wisal Dhahab Edp 50ml Spy,6293708007295,57 Pcs,96,$26.18 
Ajmal,Ajmal Wisal Edp 50ml+200SG+100BL+80BP Set,6293708004409,5 Pcs,92,$25.09 
Ajmal,Ajmal Wisal Laly Edp 50ml Spy,6293708018758,18 Pcs,110,$30.00 
Al Attaar,Al Attaar Seal of Love Edp 100ml Spy,6290171041269,120 Pcs,18,$4.91 
Al Attaar,Al Attaar Seal of Trust Edp 100ml Spy,6290171041252,1 Pcs,18,$4.91 
Al Haramain,Al Haramain Amber Oud Aqua Dubai EXP 75ml Spy,629110681459,5 Pcs,150,$40.91 
Al Haramain,Al Haramain Amber Oud Dubai Night EXP 75ml Spy,6291106814897,7 Pcs,150,$40.91 
Al Haramain,Al Haramain Amber Oud Edp 60ml Spy,6291100131709,47 Pcs,136,$37.09 
Al Haramain,Al Haramain Amber Oud Gold Edition Edp 120ml Spy,6291100130498,27 Pcs,185,$50.45 
Al Haramain,Al Haramain Amber Oud Gold Edition Edp 60ml Spy,6291100131716,35 Pcs,136,$37.09 
Al Haramain,Al Haramain Amber Oud Ruby Edition Edp 120ml Spy,6291100130559,42 Pcs,185,$50.45 
Al Haramain,Al Haramain Amber Oud Tobacco Edition Edp 60ml Spy,6291100132171,10 Pcs,136,$37.09 
Al Haramain,Al Haramain Amber Oud White Edition Edp 100ml Spy,6291100130115,4 Pcs,185,$50.45 
Al Haramain,Al Haramain Detour Noir Eco Edp 100ml Spy,,41 Pcs,55,$15.00 
Al Haramain,Al Haramain Detour Noir Eco Edp 100ml Tester,,4 Pcs,40,$10.91 
Al Haramain,Al Haramain Detour Noir Edp 100ml Spy,6291100137275,43 Pcs,58,$15.82 
Al Haramain,Al Haramain Detour Noir Exclusif Edp 100ml Spy,6291106813791,26 Pcs,55,$15.00 
Al Haramain,Al Haramain Detour Noir Intense Edp 100ml Spy,6291106813838,16 Pcs,55,$15.00 
Al Haramain,Al Haramain Etoiles Silver M Edp 100ml Spy,6291100135332,2 Pcs,45,$12.27 
Al Haramain,Al Haramain Junoon Edp 75ml Spy,6291100136285,10 Pcs,126,$34.36 
Al Haramain,Al Haramain Junoon Oud Edp 75ml Spy,6291100130184,16 Pcs,132,$36.00 
Al Haramain,Al Haramain Junoon Rose Edp 75ml Spy,6291100130849,24 Pcs,126,$34.36 
Al Haramain,Al Haramain L'aventure Intense M Edp 100ml Spy,6291100130597,6 Pcs,136,$37.09 
Al Haramain,Al Haramain L'aventure Knight Edp 100ml Spy,6291100134267,40 Pcs,92,$25.09 
Al Haramain,Al Haramain Mukhallath 12ml Oil Perfume,6291100133710,6 Pcs,16.5,$4.50 
Al Haramain,Al Haramain Opposite Pink Edp 100ml Spy,6291100137213,2 Pcs,45,$12.27 
Al Haramain,Al Haramain Oud Ma'al Attar (Medium) 40g,6291100131570,1 Pcs,40,$10.91 
Al Haramain,Al Haramain Rawaa Edp 100ml Spy,6291100131723,9 Pcs,63,$17.18 
Alexandre J,Alexandre J ADC The Majestic Amber Edp 100ml Spy (Luxury Box),3701278600868,11 Pcs,170,$46.36 
Alexandre J,Alexandre J ADC The Majestic Collection Edp 6x100ml Spy Set (Luxury Box),3701278602176,7 Pcs,880,$239.98 
Alexandre J,Alexandre J ADC The Majestic Collection Edp 6x8ml Spy Set,3701278600998,24 Pcs,143,$39.00 
Alexandre J,Alexandre J ADC The Majestic Jardin Edp 100ml Spy,3701278601032,1 Pcs,140,$38.18 
Alexandre J,Alexandre J ADC The Majestic Jardin Edp 100ml Spy (Luxury Box),3701278600882,6 Pcs,170,$46.36 
Alexandre J,Alexandre J ADC The Majestic Musk Edp 100ml Spy,3701278601001,120 Pcs,136,$37.09 
Alexandre J,Alexandre J ADC The Majestic Musk Edp 100ml Spy (Luxury Box),3701278600851,3 Pcs,170,$46.36 
Alexandre J,Alexandre J ADC The Majestic Vanilla Edp 100ml Spy,3701278601049,120 Pcs,136,$37.09 
Alexandre J,Alexandre J ADC The Majestic Vanilla Edp 100ml Spy (Luxury Box),3701278600899,31 Pcs,170,$46.36 
Alexandre J,Alexandre J ADC The Majestic Vanilla Edp 100ml Tester,3701278601308,1 Pcs,125,$34.09 
Alexandre J,Alexandre J ADC The Majestic Vetiver Edp 100ml Spy,3701278601025,120 Pcs,136,$37.09 
Alexandre J,Alexandre J ADC The Majestic Vetiver Edp 100ml Spy (Luxury Box),3701278600875,7 Pcs,170,$46.36 
Alexandre J,Alexandre J ANC Black Beetle Edp 100ml Spy,3701278602213,16 Pcs,480,$130.90 
Alexandre J,Alexandre J ANC Imperial Peacock Edp 100ml Spy,3701278602220,36 Pcs,480,$130.90 
Alexandre J,Alexandre J ANC Majestic Nard Edp 100ml Spy,3701278602183,2 Pcs,480,$130.90 
Alexandre J,Alexandre J ANC Ode to Rose Edp 100ml Spy,3701278602190,15 Pcs,480,$130.90 
Alexandre J,Alexandre J Atelier D'artistes E1 Edp 100ml Spy,3700753029620,10 Pcs,155,$42.27 
Alexandre J,Alexandre J Atelier D'artistes E3 Edp 100ml Spy,3700753029644,14 Pcs,155,$42.27 
Alexandre J,Alexandre J Atelier D'artistes E4 Edp 100ml Spy,3700753029651,2 Pcs,155,$42.27 
Alexandre J,Alexandre J Atelier D'artistes E5 Edp 100ml Spy,3700753029668,12 Pcs,155,$42.27 
Alexandre J,Alexandre J Atelier D'artistes Edp 6x8ml Spy Set,3701278600639,1 Pcs,140,$38.18 
Alexandre J,Alexandre J Le Royal Edp 60ml Spy,3700753000049`,4 Pcs,165,$45.00 
Alexandre J,Alexandre J Le Royal Edp 60ml Spy (Luxury Box),3700753000049,55 Pcs,195,$53.18 
Alexandre J,Alexandre J Oscent Black Edp 100ml Tester,"3770016770423
",6 Pcs,125,$34.09 
Alexandre J,Alexandre J Oscent White Edp 100ml Tester,3700753000995,8 Pcs,125,$34.09 
Alexandre J,Alexandre J TC Altesse Mysore Soap 60g,,117 Pcs,13,$3.55 
Alexandre J,Alexandre J TC Argentic Edp 100ml Spy,3700753001398,87 Pcs,155,$42.27 
Alexandre J,Alexandre J TC Black Muscs Edp 100ml+2x30ml+6x8ml Spy Set,3700753029675,35 Pcs,330,$89.99 
Alexandre J,Alexandre J TC Black Muscs Edp 100ml+6x8ml Spy Set,3701278602039,76 Pcs,220,$59.99 
Alexandre J,Alexandre J TC Black Muscs Edp 100ml Spy,3760016770287,120 Pcs,140,$38.18 
Alexandre J,Alexandre J TC Edp 6x100ml Spy Set (Luxury Box),3700753300000,4 Pcs,880,$239.98 
Alexandre J,Alexandre J TC Golden Oud Edp 100ml Spy,3760016770270,120 Pcs,155,$42.27 
Alexandre J,Alexandre J TC Golden Oud Edp 100ml Tester,3760016770331,27 Pcs,120,$32.72 
Alexandre J,Alexandre J TC Morning Muscs Edp 100ml+2x30ml+6x8ml Spy Set,3700753029682,52 Pcs,330,$89.99 
Alexandre J,Alexandre J TC Morning Muscs Edp 100ml+6x8ml Spy Set,3700753029514,23 Pcs,220,$59.99 
Alexandre J,Alexandre J TC Morning Muscs Edp 100ml Spy,3760016770324,120 Pcs,140,$38.18 
Alexandre J,Alexandre J TC Rose Alba Edp 100ml Spy,3701278600479,15 Pcs,155,$42.27 
Alexandre J,Alexandre J TC Rose Alba Edp 100ml Tester,3701278600486,26 Pcs,125,$34.09 
Alexandre J,Alexandre J TC Rose Oud Edp 100ml Spy,3760016770300,22 Pcs,155,$42.27 
Alexandre J,Alexandre J TC Rose Oud Edp 100ml Tester,3700753002432,17 Pcs,125,$34.09 
Alexandre J,Alexandre J TC Silver Ombre Edp 100ml Tester,,2 Pcs,115,$31.36 
Alexandre J,Alexandre J UC Liyoli Edp 50ml Tester,3700753000452,43 Pcs,92,$25.09 
Alexandre J,Alexandre J UC Pure Art Edp 50ml Tester,3700753000643,54 Pcs,92,$25.09 
Alexandre J,Alexandre J UC St.Honore Edp 45ml Tester,,3 Pcs,132,$36.00 
Alfred Verne,Alfred Verne Arabian Isle Edp 80ml Spy,6290012066161,22 Pcs,59,$16.09 
Alfred Verne,Alfred Verne Emerald Isle Edp 80ml Spy,6291100603152,70 Pcs,59,$16.09 
Alfred Verne,Alfred Verne Irish Isle Edp 80ml Spy,6291200603151,7 Pcs,59,$16.09 
Alfred Verne,Alfred Verne Just for You Edp 80ml Spy,6290103101191,1 Pcs,59,$16.09 
Amouage,Amouage Dia (2023) M Edp 100ml Tester,701666911524,4 Pcs,385,$104.99 
Amouage,Amouage Gold (2023) M Edp 100ml Tester,701666911937,4 Pcs,420,$114.54 
Amouage,Amouage Gold (2023) W Edp 100ml Tester,701666911029,5 Pcs,415,$113.17 
Amouage,Amouage Gold W Edp 100ml Spy,701666340065,5 Pcs,480,$130.90 
Amouage,Amouage Honour (2023) M Edp 100ml Spy,701666410157,3 Pcs,515,$140.44 
Amouage,Amouage Honour (2023) M Edp 100ml Tester,701666912033,3 Pcs,415,$113.17 
Amouage,Amouage Imitation (2023) M Edp 100ml Tester,701666919520,4 Pcs,385,$104.99 
Amouage,Amouage Interlude (2023) W Edp 100ml Spy,701666410201,6 Pcs,505,$137.71 
Amouage,Amouage Interlude (2023) W Edp 100ml Tester,701666917328,5 Pcs,405,$110.44 
Amouage,Amouage Love Mimosa W Edp 100ml Spy,701666265009,2 Pcs,415,$113.17 
Amouage,Amouage Love Tuberose W Edp 100ml Spy,701666264002,11 Pcs,480,$130.90 
Amouage,Amouage Material Edp 100ml Spy,701666370017,5 Pcs,495,$134.99 
Amouage,Amouage Memoir (2023) M Edp 100ml Tester,701666027881,3 Pcs,420,$114.54 
Amouage,Amouage Memoir (2023) W Edp 100ml Spy,701666410140,8 Pcs,480,$130.90 
Amouage,Amouage Memoir M Edp 100ml Spy,701666313922,2 Pcs,535,$145.90 
Amouage,Amouage Reflection (2023) W Edp 100ml Spy,701666410065,1 Pcs,515,$140.44 
Angel Schlesser,Angel Schlesser Essential M Edt 100ml Spy,8427395680204,98 Pcs,60,$16.36 
Angel Schlesser,Angel Schlesser Les Absolu Deep Leather Edp 100ml Spy,8058045427032,10 Pcs,92,$25.09 
Angel Schlesser,Angel Schlesser Les Absolu Deep Leather Edp 100ml Tester,8058045427049,12 Pcs,66,$18.00 
Angel Schlesser,Angel Schlesser Les Absolu Sensual Patchouli Edp 100ml Spy,8058045427018,9 Pcs,92,$25.09 
Angel Schlesser,Angel Schlesser Les Absolu Sensual Patchouli Edp 100ml Tester,8058045427025,12 Pcs,66,$18.00 
Angel Schlesser,Angel Schlesser Les Absolu Sublime Rose Edp 100ml Spy,8058045426998,10 Pcs,92,$25.09 
Angel Schlesser,Angel Schlesser Les Absolu Sublime Rose Edp 100ml Tester,8058045427001,12 Pcs,66,$18.00 
Antonio Banderas,AB Black Seduction M Edt 200ml Spy,8411061930878,3 Pcs,60,$16.36 
Antonio Banderas,AB Blue Seduction M Edt 100ml Spy,8411061636268,69 Pcs,42,$11.45 
Antonio Banderas,AB Blue Seduction W Edt 80ml Spy,8411061982105,54 Pcs,42,$11.45 
Aquolina,Aquolina Pink Suger Edt 100ml Spy,8033866164335,33 Pcs,40,$10.91 
Arabesque,Arabesque Bacara Extrait De Parfum 50ml Spy,6300020180022,41 Pcs,195,$53.18 
Arabesque,Arabesque Pearl Extrait De Parfum 50ml Spy,6390902027194,30 Pcs,195,$53.18 
Arabian Attars,The Beauty in Black Oud Black Edp 75ml Spy,91037103918,120 Pcs,60,$16.36 
Arabian Attars,The Beauty in Black Oud Green Edp 75ml Spy,91037103925,120 Pcs,60,$16.36 
Arabian Attars,The Beauty in Black Oud Red Edp 75ml Spy,91037103932,25 Pcs,60,$16.36 
Aramis,Aramis (Brown) Edt 110ml Spy,22548006719,120 Pcs,55,$15.00 
Aramis,Aramis (Brown) Edt 110ml Tester,,25 Pcs,45,$12.27 
Aramis,Aramis (Brown) Edt 240ml Spy,22548386231,118 Pcs,117,$31.91 
Armaf,Armaf Black Saffron Edp 100ml Spy,6294015166156,49 Pcs,59,$16.09 
Armaf,Armaf Caballo Edp 100ml Spy,6294015155648,47 Pcs,66,$18.00 
Armaf,Armaf CDN Intense M Limited Edition (2024) Parfum 105ml Spy,6294015180367,120 Pcs,175,$47.72 
Armaf,Armaf CDN Precieux I Extrait De Parfum 55ml Spy,6294015181913,120 Pcs,125,$34.09 
Armaf,Armaf CDN Private Key to My Dreams EXP 100ml Spy,6294015164992,7 Pcs,132,$36.00 
Armaf,Armaf CDN Private Key to My Life EXP 100ml Spy,6294015165012,3 Pcs,132,$36.00 
Armaf,Armaf CDN Private Key to My Love EXP 100ml Spy,6294015165029,12 Pcs,132,$36.00 
Armaf,Armaf CDN Private Key to My Success EXP 100ml Spy,6294015165005,1 Pcs,132,$36.00 
Armaf,Armaf Club De Nuit Iconic Edp 105ml Spy,6294015164152,120 Pcs,105,$28.63 
Armaf,Armaf Club De Nuit Imperiale 250ml Body Spy,6294015182866,45 Pcs,15,$4.09 
Armaf,Armaf Club De Nuit Imperiale Edp 105ml Spy,6294015164169,120 Pcs,105,$28.63 
Armaf,Armaf Club De Nuit Intense M 200ml Body Spy,6294015102413,120 Pcs,8,$2.18 
Armaf,Armaf Club De Nuit Intense M Edp 200ml Spy,6294015131024,18 Pcs,147,$40.09 
Armaf,Armaf Club De Nuit Intense M Edt 105ml+200ml Deo.Spy Set,6294015135848,73 Pcs,90,$24.54 
Armaf,Armaf Club De Nuit Intense M Edt 105ml Spy,6085010044712,120 Pcs,75,$20.45 
Armaf,Armaf Club De Nuit Intense M Parfum 150ml Spy,6294015131017,73 Pcs,136,$37.09 
Armaf,Armaf Club De Nuit Intense W Edp 105ml Spy,6085010094977,120 Pcs,66,$18.00 
Armaf,Armaf Club De Nuit M Edt 105ml Spy,6294015151596,120 Pcs,63,$17.18 
Armaf,Armaf Club De Nuit Milestone Edp 105ml Spy,6294015132120,120 Pcs,77,$21.00 
Armaf,Armaf Club De Nuit Oud Parfum 105ml Spy,6294015180251,120 Pcs,150,$40.91 
Armaf,Armaf Club De Nuit Sillage Edp 105ml Spy,6294015136470,120 Pcs,81,$22.09 
Armaf,Armaf Club De Nuit Untold Edp 105ml Spy,6294015164176,120 Pcs,105,$28.63 
Armaf,Armaf Club De Nuit Urban Elixir M 200ml Body Spy,6294015180886,120 Pcs,8,$2.18 
Armaf,Armaf Club De Nuit Urban Elixir M Edp 105ml Spy,6294015163513,120 Pcs,77,$21.00 
Armaf,Armaf Club De Nuit Urban M Edp 105ml Spy,6294015102642,120 Pcs,61,$16.63 
Armaf,Armaf Club De Nuit W 200ml Body Spy,6085010094342,84 Pcs,8,$2.18 
Armaf,Armaf Club De Nuit W 250ml Body Spy,6294015111835,80 Pcs,13.5,$3.68 
Armaf,Armaf Club De Nuit W 75g Deo.Stick,6294015132922,97 Pcs,30,$8.18 
Armaf,Armaf Club De Nuit W Edp 105ml Spy,6085010094151,120 Pcs,63,$17.18 
