Parent,Item,BARCODE,Closing,PRICE_AED, Prices us
Women'secret,Women'secret Eau My Delice Edt 100ml+200BL Set,8411114000022,1 Pcs,60,$16.36 
Women'secret,Women'secret Eau My Delice Edt 100ml Spy,8413144541117,3 Pcs,55,$15.00 
Women'secret,Women'secret Eau My Delice Edt 100ml Tester,,1 Pcs,40,$10.91 
Women'secret,Women'secret Gold Seduction Edp 100ml Spy,8411114054919,3 Pcs,65,$17.73 
Women'secret,Women'secret Gold Seduction Edp 100ml Tester,,2 Pcs,45,$12.27 
Xerjoff,Xerjoff 17/17 Elle Parfum 100ml Spy,8033488155421,5 Pcs,980,$267.25 
Xerjoff,Xerjoff 17/17 Pikovaya Dama Parfum 100ml Spy,8033488157449,10 Pcs,980,$267.25 
Xerjoff,Xerjoff 17/17 Symphonium Parfum 100ml Spy,8033488155551,6 Pcs,980,$267.25 
Xerjoff,Xerjoff 1861 Naxos Edp 100ml Spy,8033488155070,72 Pcs,525,$143.17 
Xerjoff,Xerjoff Accento Edp 100ml Spy,8054320902553,120 Pcs,505,$137.71 
Xerjoff,Xerjoff Accento Edp 100ml Tester,8054320902577,46 Pcs,405,$110.44 
Xerjoff,Xerjoff Accento Edp 50ml Spy,8054320902560,72 Pcs,350,$95.45 
Xerjoff,Xerjoff Accento Overdose Edp 100ml Spy,8054320902614,8 Pcs,550,$149.99 
Xerjoff,Xerjoff Amabile Edp 100ml Spy,8054320900009,2 Pcs,405,$110.44 
Xerjoff,Xerjoff ATP Torino21 Edp 50ml Spy,8054320901211,15 Pcs,450,$122.72 
Xerjoff,Xerjoff Casamorati 1888 Bouquet Ideale Edp 100ml Spy,8033488153588,1 Pcs,425,$115.90 
Xerjoff,Xerjoff Casamorati 1888 Dolce Amalfi Edp 100ml Spy,8033488150112,6 Pcs,425,$115.90 
Xerjoff,Xerjoff Casamorati 1888 Edp 100ml Tester,8033488153274,3 Pcs,335,$91.36 
Xerjoff,Xerjoff Casamorati 1888 Gran Ballo Edp 100ml Spy,8033488153281,5 Pcs,425,$115.90 
Xerjoff,Xerjoff Casamorati 1888 Lira Edp 30ml Spy,8033488154547,5 Pcs,220,$59.99 
Xerjoff,Xerjoff Erba Gold Edp 100ml Spy,8054320902522,120 Pcs,630,$171.80 
Xerjoff,Xerjoff Erba Gold Edp 100ml Tester,8054320902546,32 Pcs,510,$139.08 
Xerjoff,Xerjoff Erba Pura Edp 100ml Spy,8054320902584,120 Pcs,505,$137.71 
Xerjoff,Xerjoff Erba Pura Edp 100ml Tester,8054320902607,41 Pcs,405,$110.44 
Xerjoff,Xerjoff Join the Club 400 Edp 50ml Spy,8054320900276,9 Pcs,425,$115.90 
Xerjoff,Xerjoff Join the Club 40 Knots Edp 100ml Spy,8033488155155,16 Pcs,550,$149.99 
Xerjoff,Xerjoff Join the Club 40 Knots Edp 100ml Tester,8033488155308,17 Pcs,450,$122.72 
Xerjoff,Xerjoff Join the Club 40 Knots Edp 50ml Spy,8033488155148,4 Pcs,365,$99.54 
Xerjoff,Xerjoff Join the Club More Than Words Edp 100ml Spy,8033488155131,75 Pcs,525,$143.17 
Xerjoff,Xerjoff Join the Club More Than Words Edp 100ml Tester,8033488155292,18 Pcs,425,$115.90 
Xerjoff,Xerjoff Join the Club More Than Words Edp 50ml Spy,8033488155124,79 Pcs,365,$99.54 
Xerjoff,Xerjoff K Collection Kemi Parfum 50ml Spy,8054320900900,18 Pcs,450,$122.72 
Xerjoff,Xerjoff Laylati Edp 100ml Spy,8033488156343,10 Pcs,475,$129.53 
Xerjoff,Xerjoff Laylati Edp 100ml Tester,,3 Pcs,385,$104.99 
Xerjoff,Xerjoff Laylati Edp 50ml Spy,8033488158767,19 Pcs,325,$88.63 
Xerjoff,"Xerjoff Oud Star Edp 15ml+4x2ml Sample, Al Khatt+Luxor+ Fars+Malesia Set",,57 Pcs,185,$50.45 
Xerjoff,Xerjoff Oud Stars Alexandria II Hair Mist 30ml Spy,8033488156060,6 Pcs,165,$45.00 
Xerjoff,Xerjoff Oud Stars Alexandria III Parfum 50ml Spy,8033488159207,47 Pcs,550,$149.99 
Xerjoff,Xerjoff Oud Stars Alexandria III Parfum 50ml Tester,8033488159214,22 Pcs,450,$122.72 
Xerjoff,Xerjoff Oud Stars Alexandria II Parfum 100ml Spy,8033488154967,37 Pcs,880,$239.98 
Xerjoff,Xerjoff Oud Stars Alexandria II Parfum 50ml Spy,8033488154950,46 Pcs,550,$149.99 
Xerjoff,Xerjoff Shooting Stars Oesel Parfum 50ml Spy,8033488151959,12 Pcs,440,$119.99 
Yves Sain Laurent,YSL Black Opium W Edp 50ml Spy,3365440787919,17 Pcs,205,$55.90 
Yves Sain Laurent,YSL Black Opium W Le Parfum 90ml Spy,3614273863360,19 Pcs,285,$77.72 
Yves Sain Laurent,YSL Cinema W Edp 90ml Spy,3365440258938,27 Pcs,340,$92.72 
Yves Sain Laurent,YSL Dessin Du Regard Waterproof Eye Pencil .8g,,120 Pcs,15,$4.09 
Yves Sain Laurent,YSL Kouros Edt 100ml Spy,3365440003866,120 Pcs,198,$54.00 
Yves Sain Laurent,YSL L'homme 50ml Shower Gel,,103 Pcs,11,$3.00 
Yves Sain Laurent,YSL L'homme Edp 100ml Spy,3614273668743,45 Pcs,265,$72.27 
Yves Sain Laurent,YSL L'homme Edt 100ml+50SG Travel Set,3660732601509,16 Pcs,235,$64.09 
Yves Sain Laurent,YSL L'homme Edt 100ml Spy,3365440316560,76 Pcs,225,$61.36 
Yves Sain Laurent,YSL L'homme Le Parfume 100ml Spy,3614272890626,50 Pcs,265,$72.27 
Yves Sain Laurent,YSL La Nuit De L'homme 50ml Shower Gel,,120 Pcs,11,$3.00 
Yves Sain Laurent,YSL La Nuit De L'homme Edp 100ml Spy,3614272648333,18 Pcs,265,$72.27 
Yves Sain Laurent,YSL La Nuit De L'homme Edt 100ml+50SG Travel Set,3660732601493,1 Pcs,235,$64.09 
Yves Sain Laurent,YSL La Nuit De L'homme Edt 100ml Spy,3365440375079,120 Pcs,225,$61.36 
Yves Sain Laurent,YSL La Nuit De L'homme Edt 60ml Spy,3365440375055,3 Pcs,165,$45.00 
Yves Sain Laurent,YSL Libre 50ml Shower Gel,3614272966949,102 Pcs,11,$3.00 
Yves Sain Laurent,YSL Libre Edp 10ml Mini Spy (W/O Box),,120 Pcs,33,$9.00 
Yves Sain Laurent,YSL Libre Edp 50ml Spy,3614272648418,102 Pcs,250,$68.18 
Yves Sain Laurent,YSL Libre Edp 90ml Spy,3614272648425,43 Pcs,330,$89.99 
Yves Sain Laurent,YSL Libre Intense Edp 90ml Spy,3614273069557,12 Pcs,375,$102.26 
Yves Sain Laurent,YSL Myslf Edp 100ml Spy Refillable,3614273852814,1 Pcs,280,$76.36 
Yves Sain Laurent,YSL Myslf Edp 60ml Spy Refillable,3614273852821,6 Pcs,215,$58.63 
Yves Sain Laurent,YSL Opium M Edt 100ml Spy,3365440025578,115 Pcs,260,$70.90 
Yves Sain Laurent,YSL Paris Edt 125ml Spy,3365440002197,8 Pcs,240,$65.45 
Yves Sain Laurent,YSL Tuxedo Epices - Patchouli Edp 125ml Spy,3614270699733,43 Pcs,660,$179.98 
Yves Sain Laurent,YSL Y M 75g Deo.Stick,3614271717092,120 Pcs,55,$15.00 
Yves Sain Laurent,YSL Y M Edp 100ml Spy,3614272050358,7 Pcs,275,$74.99 
Yves Sain Laurent,YSL Y M Edt 100ml Spy,3614271716026,118 Pcs,225,$61.36 
Yves Sain Laurent,YSL Y M Edt 60ml Spy,3614273683395,75 Pcs,175,$47.72 
Yves Sain Laurent,YSL Y M Intense Edp 100ml Spy,3614273898478,120 Pcs,295,$80.45 
Yves Sain Laurent,YSL Y M Le Parfum 100ml Spy,3614273318105,106 Pcs,295,$80.45 
Zimaya,Zimaya A Fairy Tale Edp 100ml Spy,6290171071006,42 Pcs,39,$10.64 
Zimaya,Zimaya A La Rose EXP 100ml Spy,6290171070993,38 Pcs,39,$10.64 
Zimaya,Zimaya Amber Is Great EXP 100ml Spy,6290171070283,60 Pcs,39,$10.64 
Zimaya,Zimaya Bouquet Red Edp 100ml Spy,6290171073482,55 Pcs,39,$10.64 
Zimaya,Zimaya Brave Heart Edp 100ml Spy,6290171071037,7 Pcs,39,$10.64 
Zimaya,Zimaya Fatima EXP 100ml Spy,6290171071051,44 Pcs,39,$10.64 
Zimaya,Zimaya Musk Is Great EXP 100ml Spy,6290171070276,114 Pcs,39,$10.64 
Zimaya,Zimaya Night Shadow Edp 100ml Spy,6290171072874,58 Pcs,39,$10.64 
Zimaya,Zimaya Oud Is Great EXP 100ml Spy,6290171070269,46 Pcs,39,$10.64 
Zimaya,Zimaya Rose of Dreams Edp 100ml Spy,6290171072867,64 Pcs,39,$10.64 
Zimaya,Zimaya Royal Leather Edp 100ml Spy,6290171071044,4 Pcs,39,$10.64 
Zimaya,Zimaya Sharaf Blend Edp 100ml Spy,6290171074205,48 Pcs,66,$18.00 
Zippo,Zippo Acid Green Edt 90ml Spy Refillable,679602711838,40 Pcs,39,$10.64 
Zippo,Zippo Bright Pink Masculino Edt 90ml Spy Refillable,679602711845,40 Pcs,39,$10.64 
Zippo,Zippo Dresscode Black Edt 100ml Tester,679602089029,19 Pcs,36,$9.82 
Zippo,Zippo Feelzone for Her Edt 75ml Tester,679602919029,27 Pcs,25,$6.82 
Zippo,Zippo Feelzone for Him Edt 75ml Tester,679602819022,4 Pcs,25,$6.82 
Zippo,Zippo Glorious Edt 75ml Spy,679602720816,1 Pcs,40,$10.91 
Zippo,Zippo Glorious Edt 75ml Tester,679602729024,50 Pcs,25,$6.82 
Zippo,Zippo Mythos PH Edt 75ml Tester,679602719025,27 Pcs,25,$6.82 
Zippo,Zippo on the Road PH Edt 100ml+150ml Deo.Set,679602739412,80 Pcs,50,$13.64 
Zippo,Zippo on the Road PH Edt 100ml Tester,679602739023,36 Pcs,35,$9.54 
Zippo,Zippo on the Road PH Edt 50ml Spy Refillable,679602731065,2 Pcs,35,$9.54 
Zippo,Zippo Stardust W Edp 75ml Spy,679602801089,120 Pcs,37,$10.09 
Zippo,Zippo Stardust W Edp 75ml Tester,679602809023,38 Pcs,25,$6.82 
Zippo,Zippo The Woman Edp 75ml Spy,679602791083,115 Pcs,37,$10.09 
Zippo,Zippo The Woman Edp 75ml Tester,679602970020,73 Pcs,25,$6.82 
AA Zaafaran,AZ.Al Dirgham Limited Edition Edp 100ml Spy,6423080624234,9 Pcs,32,$8.73 
AA Zaafaran,AZ.Al Dirgham Limited Edition Edp 100ml Spy,6423080624234,31 Pcs,32,$8.73 
AA Zaafaran,AZ.Al Dirgham Limited Edition Edp 100ml Spy,6423080624234,29 Pcs,32,$8.73 
AA Zaafaran,AZ.Al Dur Al Maknoon Edp 50ml Spy,6423080605073,5 Pcs,8,$2.18 
AA Zaafaran,AZ.Al Qannas Edp 100ml Spy,6423080717264,27 Pcs,30,$8.18 
AA Zaafaran,AZ.Al Sayaad for Man Edp 100ml Spy,6423080615355,3 Pcs,28,$7.64 
AA Zaafaran,AZ.Amal Edp 100ml Spy,6423080722671,6 Pcs,28,$7.64 
AA Zaafaran,AZ.Ameerat Al Arab Edp 50ml Spy,6423080730232,10 Pcs,8,$2.18 
AA Zaafaran,AZ. Ameerat Al Arab (Red) Bukhoor 40gm,6295845451849,12 Pcs,6,$1.64 
AA Zaafaran,AZ.Bab Al Hamra Edp 100ml Spy,6423080728840,11 Pcs,31,$8.45 
AA Zaafaran,AZ.Bab Al Wardi Edp 100ml Spy,6423080728857,11 Pcs,34,$9.27 
AA Zaafaran,AZ. Bint Hooran Edp 50ml Spy,6423080714911,12 Pcs,8,$2.18 
AA Zaafaran,AZ. Bukoor Ahlam Al Arab 40gm,6315478897422,1 Pcs,5,$1.36 
AA Zaafaran,AZ. Bukoor Amwaj 40gm,6295847158579,8 Pcs,5,$1.36 
AA Zaafaran,AZ. Bukoor Sheikh Shuyukh 40gm,6598865247837,10 Pcs,5,$1.36 
AA Zaafaran,AZ.Daar Al Haneen Edp 100ml Spy,6423080597675,12 Pcs,28,$7.64 
AA Zaafaran,AZ.Dar Al Shabaab Edp 100ml+50ml Deo Spy,6423080595015,8 Pcs,28,$7.64 
AA Zaafaran,AZ.Dar Al Shabaab Edp 20ml Pocket Spy,6458970598654,14 Pcs,3.3,$0.90 
AA Zaafaran,AZ.Dar Al Shabaab Royal Edp 100ml Spy,6266515361812,1 Pcs,28,$7.64 
AA Zaafaran,AZ.Desert Sultan Sapphire Edp 100ml Spy,6435074242713,1 Pcs,28,$7.64 
AA Zaafaran,AZ.Dirham Air Freshner 300ml Spy,6246756782430,10 Pcs,6,$1.64 
AA Zaafaran,AZ.Dirham Edp 100ml+50ml Deo.Spy,6294355452612,32 Pcs,24,$6.54 
AA Zaafaran,AZ.Dirham Edp 100ml Spy,6151513645128,10 Pcs,20,$5.45 
AA Zaafaran,AZ.Dirham Edp 20ml Pocket Spy,6448659875244,120 Pcs,3.3,$0.90 
AA Zaafaran,AZ.Dirham Edp 50ml Spy,6423080603345,1 Pcs,8,$2.18 
AA Zaafaran,AZ.Dirham Gold Edition Edp 100ml Spy,6423080608449,54 Pcs,20,$5.45 
AA Zaafaran,AZ.Dirham Oud Edp 100ml Spy,6423080608432,3 Pcs,20,$5.45 
AA Zaafaran,AZ.Dirham Wardi Air Freshner 300ml Spy,6824637104337,12 Pcs,6,$1.64 
AA Zaafaran,AZ.Dirham Wardi Edp 100ml Spy,6423080609965,11 Pcs,21,$5.73 
AA Zaafaran,AZ.Dirham Wardi Edp 20ml Pocket Spy,6258454544531,8 Pcs,3.3,$0.90 
AA Zaafaran,AZ. Fakhar Al Oud Edp 100ml Spy,6435074242850,20 Pcs,36,$9.82 
AA Zaafaran,AZ. Fakhar Silver Air Freshner 300ml Spy,6824637104344,11 Pcs,6,$1.64 
AA Zaafaran,AZ.I Am the King Edp 100ml Spy,6266515361799,4 Pcs,28,$7.64 
AA Zaafaran,AZ.I Am the Queen Edp 100ml Spy,6266515361805,3 Pcs,28,$7.64 
AA Zaafaran,AZ.Jazzab Gold Edp 100ml Spy,6791106166069`,12 Pcs,28,$7.64 
AA Zaafaran,AZ.Jazzab Silver Edp 100ml Spy,6791516166406,22 Pcs,25,$6.82 
AA Zaafaran,AZ.Manasib Edp 100ml Spy,6423080622995,13 Pcs,29,$7.91 
AA Zaafaran,AZ.Maqaal Oud Edp 50ml Spy,6423080622919,13 Pcs,35,$9.54 
AA Zaafaran,AZ.Midnight Oud Edp 100ml Spy,6205413337789,57 Pcs,25,$6.82 
AA Zaafaran,AZ.Midnight Oud Edp 50ml Spy,6423080615799,9 Pcs,8,$2.18 
AA Zaafaran,AZ.Mousuf Edp 100ml Spy,6437842514039,51 Pcs,28,$7.64 
AA Zaafaran,AZ.Mousuf Wardi Edp 100ml Spy,6432462223807,16 Pcs,28,$7.64 
AA Zaafaran,AZ.Mukallat Sharqia Edp 100ml Spy,6423080592496,6 Pcs,24,$6.54 
AA Zaafaran,AZ.Mukammaria Jamid Oudi 20grm,6423080605479,8 Pcs,11,$3.00 
AA Zaafaran,AZ.Naqeeb Edp 100ml Spy,6435000125493,1 Pcs,22,$6.00 
AA Zaafaran,AZ.Oud 24 Hours Edp 100ml Spy,6423080594773,13 Pcs,28,$7.64 
AA Zaafaran,AZ.Oud 24 Hours Edp 20ml Pocket Spy,6425830083308,1 Pcs,3.3,$0.90 
AA Zaafaran,AZ.Oud 24 Hours Edp 50ml Spy,6423080603406,15 Pcs,8,$2.18 
AA Zaafaran,AZ.Oud Abiyedh Edp 100ml Spy,6426185651037,9 Pcs,24,$6.54 
AA Zaafaran,AZ.Oud Abiyedh Edp 20ml Pocket Spy,642443426653,4 Pcs,3.3,$0.90 
AA Zaafaran,AZ.Oud Al Lail Edp 100ml Spy,6423080598948,3 Pcs,14,$3.82 
AA Zaafaran,AZ.Oud Collection Mousuf Edp 20ml Pocket Spy,6545254384536,12 Pcs,3.3,$0.90 
AA Zaafaran,AZ.Oudi Edp 100ml+50ml Deo Spy,6205207142612,12 Pcs,24,$6.54 
AA Zaafaran,AZ.Oudi Edp 100ml Spy,6423080594766,26 Pcs,20,$5.45 
AA Zaafaran,AZ.Oud Mood Edp 50ml Spy,6423080607268,1 Pcs,8,$2.18 
AA Zaafaran,AZ.Oud Sharqiya Edp 80ml+50ml Deo Spy,6312258901256,13 Pcs,25,$6.82 
AA Zaafaran,AZ.Oud Sharqiya Edp 80ml Spy,6312258901256`,7 Pcs,20,$5.45 
AA Zaafaran,AZ. Raghba Edp 20ml Pocket Spy,642443426653A,8 Pcs,3.3,$0.90 
AA Zaafaran,AZ. Raghba Edp 50ml Spy,6423080713112,4 Pcs,8,$2.18 
AA Zaafaran,AZ.Riqqa Edp 100ml Spy,6438585524668,1 Pcs,52,$14.18 
AA Zaafaran,AZ.Safeer Al Oud Edp 100ml Spy,,2 Pcs,28,$7.64 
AA Zaafaran,AZ.Sama Dubai Edp 100ml Spy,6423080594056,11 Pcs,21,$5.73 
AA Zaafaran,AZ. Sayaad Al Quloob Edp 50ml Spy,6423080615966,12 Pcs,8,$2.18 
AA Zaafaran,AZ.Shams Al Emarat Edp 100ml Spy,6432452224200,4 Pcs,20,$5.45 
AA Zaafaran,AZ.Shams Al Emarat Edp 20ml Pocket Spy,6479211046598,8 Pcs,3.3,$0.90 
AA Zaafaran,AZ.Shams Al Emarat Khususi Edp 100ml+50ml Deo Spy,6205203042138,1 Pcs,24,$6.54 
AA Zaafaran,AZ.Shams Al Emarat Khususi Edp 100ml Spy,6322145419856,4 Pcs,20,$5.45 
AA Zaafaran,AZ.Shams Al Emarat Khususi Edp 20ml Pocket Spy,6448669253476,12 Pcs,3.3,$0.90 
AA Zaafaran,AZ.Sheikh Shuyukh Edp 20ml Pocket Spy,6479211098238,11 Pcs,3.3,$0.90 
AA Zaafaran,AZ.Sultan Al Shabab Air Freshner 300ml Spy,6266414891236,11 Pcs,6,$1.64 
AA Zaafaran,AZ.Turab Al Dhahab Edp 100ml Spy,6423080593851,2 Pcs,20,$5.45 
AA Zaafaran,AZ. Wafa Edp 100ml Spy,6435000123628,2 Pcs,42,$11.45 
AA Zaafaran,AZ. Yara (Pink) Edp 50ml Spy,6423080728925,6 Pcs,8,$2.18 
Al Nuaim,Al Nuaim Blue Wave 20ml Roll on (Non Alcohol),6292014105527,11 Pcs,18,$4.91 
Al Nuaim,Al Nuaim Kashmiri Oudh 6ml Roll on (Non Alcohol),6292014101079,9 Pcs,6.5,$1.77 
Al Nuaim,Al Nuaim Rose 6ml Roll on (Non Alcohol),6292014102670,9 Pcs,5,$1.36 
Al Nuaim,Al Nuaim Salina Salina 20ml Roll on (Non Alcohol),6292014105541,11 Pcs,18,$4.91 
Al Nuaim,Al Nuaim Silver 6ml Roll on (Non Alcohol),6292014104612,12 Pcs,5,$1.36 
Al Nuaim,Al Nuaim Strawberry Melon 6ml Roll on (Non Alcohol),6292014101321,11 Pcs,5,$1.36 
Al Oraib,Dar Al Hai Edp 80ml Spy,6423080594783,1 Pcs,20,$5.45 
Al Oraib,Elle Sport Edp 100ml Spy,6291104730656,1 Pcs,30,$8.18 
Al Oraib,Prestige Al Maliki 100ml Spy,3587956293738,1 Pcs,21,$5.73 
Al Rehab,Al Rehab Aseel Edp 35ml Spy,6291110003355,1 Pcs,7.5,$2.05 
Al Rehab,Al Rehab Assorted Oil Perfume 6ml Roll on,,2 Pcs,5,$1.36 
Al Rehab,Al Rehab Avenue Edp 100ml Spy,6291110095657,10 Pcs,42,$11.45 
Al Rehab,Al Rehab Blanc Edp 50ml Spy,,3 Pcs,8,$2.18 
Al Rehab,Al Rehab Chelsea M Oil Perfume 6ml Roll on,,3 Pcs,5.5,$1.50 
Al Rehab,Al Rehab Choco Musk 50ml Spy,6291110091642,28 Pcs,8,$2.18 
Al Rehab,Al Rehab Dalal Edp 50ml Spy,,9 Pcs,8,$2.18 
Al Rehab,Al Rehab Distance Edp 50ml Spy,6291110019660,18 Pcs,8,$2.18 
Al Rehab,Al Rehab French Coffee Edp 100ml Spy,6291110100078,120 Pcs,33,$9.00 
Al Rehab,Al Rehab French Coffee Edp 50ml Spy,6291110108821,46 Pcs,10,$2.73 
Al Rehab,Al Rehab Officer Edp 100ml Spy,6291110100085,9 Pcs,44,$12.00 
Al Rehab,Al Rehab Sabaya Edp 50ml Spy,6291110016195,4 Pcs,8,$2.18 
Al Rehab,Al Rehab Secret Man Edp 100ml Spy,6281110021212,3 Pcs,41,$11.18 
Al Rehab,Al Rehab Shadha Edp 35ml Spy,6291110002266,1 Pcs,7.5,$2.05 
Al Rehab,Al Rehab Sultan Edp 35ml Spy,6291110010353,4 Pcs,7.5,$2.05 
Al Rehab,Al Rehab Superman Edp 50ml Spy,6291110004703,5 Pcs,8,$2.18 
Al Rehab,Al Rehab Zidan 35ml Spy,6291110010902,10 Pcs,7.5,$2.05 
Al Wataniah,Al Wataniah Attar Al Wesal Edp 100ml Spy,5055810014933,39 Pcs,28,$7.64 
Al Wataniah,Al Wataniah Durrat Al Aroos Edp 85ml Spy,5055810012786,30 Pcs,28,$7.64 
Al Wataniah,Al Wataniah Kayaan Classic Edp 100ml Spy,5055810030414,57 Pcs,50,$13.64 
Al Wataniah,Al Wataniah Kayaan Gold Edp 100ml Spy,5055810030421,26 Pcs,50,$13.64 
Al Wataniah,Al Wataniah Kenz Al Malik Edp 100ml Spy,5055810024925,40 Pcs,28,$7.64 
Al Wataniah,Al Wataniah Oud Mystery Intense Edp 100ml Spy,5055810030131,44 Pcs,33,$9.00 
Al Wataniah,Al Wataniah Sabah Al Ward Edp 100ml Spy,5055810013110,39 Pcs,28,$7.64 
Al Wataniah,Al Wataniah Shagaf Al Ward Edp 100ml Spy,5055810007720,42 Pcs,28,$7.64 
Al Wataniah,Al Wataniah Watani Purple Edp 100ml Spy,5055810012274,30 Pcs,28,$7.64 
Alina Corel,Alina Corel Monsieur Candy Rose W Edp 100ml Spy,6423080722237,89 Pcs,33,$9.00 
Amaran,Amaran Heaven by Amaran Liberty Edp 100ml Spy,6291109843924,1 Pcs,45,$12.27 
Amaran,Amaran Oxana Black W Edp 100ml Spy,6291108727522,19 Pcs,45,$12.27 
Angry Birds,Angry Birds Rio Edt 100ml Tester,,1 Pcs,18,$4.91 
Angry Birds,Angry Birds Rio Edt 50ml Spy,663350060331,12 Pcs,18,$4.91 
Arabian Mystery,Arabian Mystery Edp 100ml Spy,8802567771087,2 Pcs,35,$9.54 
Arabiyat,Arabiyat Al Faris Con.Perfume Oil 12ml,6298655988000,37 Pcs,16,$4.36 
Arabiyat,Arabiyat Al Faris Edp 100ml+200ml Deo.Spy Set,6290788284059,120 Pcs,26,$7.09 
Arabiyat,Arabiyat Al Faris Edp 100ml Spy,6330848654542,1 Pcs,22,$6.00 
Arabiyat,Arabiyat Intense Musk Edp 100ml Spy,6335896587453,10 Pcs,22,$6.00 
Arabiyat,Arabiyat Intense Oud Con.Perfume Oil 12ml,6298045400402,45 Pcs,16,$4.36 
Arabiyat,Arabiyat Intense Oud Edp 100ml+200ml Deo.Spy Set,6300020153675,114 Pcs,26,$7.09 
Arabiyat,Arabiyat Intense Oud Edp 100ml Spy,6300020152333`,11 Pcs,22,$6.00 
Arabiyat,Arabiyat Lamsat Harir Con.Perfume Oil 12ml,6297804544586,47 Pcs,16,$4.36 
Arabiyat,Arabiyat Lamsat Harir Edp 100ml+200ml Deo.Spy Set,6300020153538,120 Pcs,26,$7.09 
Arabiyat,Arabiyat Oud Al Layl Con.Perfume Oil 12ml,6298704545048,52 Pcs,16,$4.36 
Arabiyat,Arabiyat Oud Al Layl Edp 100ml+200ml Deo.Spy Set,6300020154573,59 Pcs,26,$7.09 
Ard Al Shuyukh,Ard Al Shuyukh Fazza Al Malika Edp 100ml Spy,6291108954119,10 Pcs,34,$9.27 
Autobiography,Autobiography Oh Boy ! Edp 50ml Spy,6293559898134,3 Pcs,35,$9.54 
Autobiography,Autobiography Paramount Edp 50ml Spy,6293759898132,11 Pcs,35,$9.54 
Autobiography,Autobiography Rich Leather Edp 50ml Spy,6292560803748,6 Pcs,35,$9.54 
Autobiography,Autobiography Supreme Gold Edp 50ml Spy,6292560803755,6 Pcs,35,$9.54 
Barbie,Barbie 200ml Body Spy.5237,663350052374,6 Pcs,19,$5.18 
Barbie,Barbie Edt 75ml Spy,8411114092409,16 Pcs,31,$8.45 
Baug Sons,BS.Creation Noir PH Edp 100ml Spy,6320410004004,6 Pcs,26,$7.09 
Baug Sons,BS.Edge Pour Homme Edp 100ml Spy,6055775783034,4 Pcs,20,$5.45 
Benetton,Benetton Cold Edt 100ml Spy,3605473198185,17 Pcs,17,$4.64 
Benetton,Benetton Cold Silver Edt 100ml Spy,3605473176732,21 Pcs,17,$4.64 
Benetton,Benetton Hot Edt 100ml Spy,3605473198178,2 Pcs,17,$4.64 
Benetton,Benetton Hot Gold Edt 100ml Spy,3605473176725,22 Pcs,17,$4.64 
Bernard Dimitri,Hot Black Edt 100ml Spy,3354259846238,80 Pcs,15,$4.09 
Bernard Dimitri,Hot Blanc Edt 100ml Spy,3354259846252,9 Pcs,17,$4.64 
Bernard Dimitri,Hot Oud Edp 100ml Spy,33542591846269,5 Pcs,17,$4.64 
Beverly Hills Polo Club,BHPC Sport M No.01 Edt 50ml Spy,8718719850084,1 Pcs,32,$8.73 
Beverly Hills Polo Club,BHPC Sport M No.02 Edt 50ml Spy,8718719850114,2 Pcs,32,$8.73 
Beverly Hills Polo Club,BHPC Sport M No.08 Edt 50ml Spy,8718719850107,2 Pcs,32,$8.73 
Beverly Hills Polo Club,BHPC W No.02 Edp 50ml Spy,8718719850312,1 Pcs,32,$8.73 
Bleu Blanc,Bleu Blanc Freedom Gold Edp 100ml Spy,3325658545251,2 Pcs,85,$23.18 
Bleu Blanc,Bleu Blanc Freedom Gold Red Edp 100ml Spy,33256585455251,1 Pcs,85,$23.18 
Bleu Blanc,Bleu Blanc Freedom Silver Red Edp 100ml Spy,3350405689209,2 Pcs,85,$23.18 
Brandy Designs,Brandy Salvage Edp 100ml Spy,7426968203483,1 Pcs,45,$12.27 
CEP,CEP Diego Activate Edt 50ml+Binocular Set,,6 Pcs,30,$8.18 
CEP,CEP Diego Activate Edt 50ml Spy,3298839231253,1 Pcs,29,$7.91 
Clayeux Parfums,Boy Edt 100ml Spy-2070,,3 Pcs,31,$8.45 
Clayeux Parfums,Boy Edt 50ml Spy-2071,,3 Pcs,19,$5.18 
Clayeux Parfums,Girl Edt 50ml Spy-2081,,3 Pcs,19,$5.18 
Clayeux Parfums,Maelle Coeur Edt 100ml Spy-2050,,3 Pcs,31,$8.45 
Clayeux Parfums,Maelle Coeur Edt 50ml Spy-2051,,2 Pcs,19,$5.18 
Clayeux Parfums,Maelle Fleur Edt 100ml Spy-2040,,6 Pcs,31,$8.45 
Clayeux Parfums,Moi Bebe Blue Eds 50ml Spy-2010,,1 Pcs,19,$5.18 
Clayeux Parfums,Moi Bebe Boys Eds 50ml Spy-2010,,4 Pcs,19,$5.18 
Colour Me,Colour Me Dark Red W Edp 100ml Spy,25929209358,11 Pcs,30,$8.18 
Colour Me,Colour Me Green M Edt 90ml Spy,,11 Pcs,30,$8.18 
Colour Me,Colour Me Oud M Edp 90ml Spy,25929129823,34 Pcs,30,$8.18 
Colour Me,Colour Me Pearl W Edp 100ml Spy,25929129854,12 Pcs,30,$8.18 
Colour Me,Colour Me Pink W Edp 100ml Spy,25929126907,57 Pcs,30,$8.18 
Colour Me,Colour Me Purple W Edp 100ml Spy,25929129205,62 Pcs,30,$8.18 
Colour Me,Colour Me Red W Edp 100ml Spy,,6 Pcs,30,$8.18 
Colour Me,Colour Me Sky Blue W Edp 100ml Spy,,10 Pcs,30,$8.18 
Colour Me,Colour Me White M Edt 90ml Spy,,12 Pcs,30,$8.18 
Cornells,Cornells Batman 250ml Body Mist,6294015144192,11 Pcs,13,$3.55 
Cornells,Cornells Batman Edp 30ml Spy,6294015144147,20 Pcs,13,$3.55 
Cornells,Cornells Hello Kitty 250ml Body Mist,6294015144239,35 Pcs,13,$3.55 
Cornells,Cornells Hello Kitty Edp 15ml Mini Spy,6858475412767,2 Pcs,8,$2.18 
Cornells,Cornells Hello Kitty Edp 30ml Spy,6294015144185,2 Pcs,13,$3.55 
Cornells,Cornells Superman 250ml Body Mist,6294015144208,27 Pcs,13,$3.55 
Cornells,Cornells Superman Edp 15ml Mini Spy,6294015144109,6 Pcs,8,$2.18 
Cornells,Cornells Superman Edp 30ml Spy,6294015144154,23 Pcs,13,$3.55 
Cornells,Cornells TH Joker H. Senitizer 65ml Gel+100ml  Set,6294015142532,1 Pcs,13,$3.55 
Cornells,Cornells Tom and Jerry 250ml Body Mist,6294015144222,4 Pcs,13,$3.55 
Cornells,Cornells Tom and Jerry Edp 15ml Mini Spy,6294015144123,9 Pcs,8,$2.18 
Danielhills,Danielhills Blue M Edt 100ml Spy,8964000835487,11 Pcs,15,$4.09 
Danielhills,Danielhills Red M Edt 100ml Spy,8964000835494,1 Pcs,15,$4.09 
Danielhills,Danielhills White M Edt 100ml Spy,3587925338649,11 Pcs,15,$4.09 
Daniella Alderic,Deniella Alderic Royal Black Edt 100ml Spy,3745087584742,32 Pcs,20,$5.45 
Deluxe Parfum,DP.Diva Magic W Edp 100ml Spy,3841222527633,1 Pcs,28,$7.64 
Deluxe Parfum,DP.Diva Noir W Edp 100ml Spy,3841222515395,1 Pcs,28,$7.64 
Deluxe Parfum,DP.Diva Shiny W Edp 100ml Spy,3841222515357,1 Pcs,28,$7.64 
Dhamma Perfumes,Dhamma Aro-Fac Fiery Edp 100ml Spy,,1 Pcs,26,$7.09 
Dhamma Perfumes,Dhamma Aro-Fac Orchid-14 Edp 100ml Spy,6292663581383,1 Pcs,24,$6.54 
Dhamma Perfumes,Dhamma Aro-Fac Vape Edp 100ml Spy,6298141927674,1 Pcs,26,$7.09 
Dhamma Perfumes,Dhamma Aro-Fac Vibes  Edp 100ml Spy,6293323195288,1 Pcs,24,$6.54 
Dhamma Perfumes,Dhamma Ash Parfum 100ml Spy,6298141921504,1 Pcs,26,$7.09 
Dhamma Perfumes,Dhamma Club Edp 100ml Spy,6298141927186,8 Pcs,29,$7.91 
Dhamma Perfumes,Dhamma Collection D'odeurs Arome Ravisant 100ml Spy,6292655802755,1 Pcs,24,$6.54 
Dhamma Perfumes,Dhamma Collection D'odeurs Avenues 100ml Spy,6292655802700,1 Pcs,24,$6.54 
Dhamma Perfumes,Dhamma Collection D'odeurs Cuir Riche 100ml Spy,6292655802731,1 Pcs,24,$6.54 
Dhamma Perfumes,Dhamma Collection D'odeurs Smoky Vanlla 100ml Spy,6292655802779,1 Pcs,24,$6.54 
Dhamma Perfumes,Dhamma Fabrica Aromas Crema EXP 100ml Spy,6298141922341,1 Pcs,26,$7.09 
Dhamma Perfumes,Dhamma Fabrica Aromas Dulce EXP 100ml Spy,6298141922280,1 Pcs,24,$6.54 
Dhamma Perfumes,Dhamma Fabrica Aromas Piton EXP 100ml Spy,6298141922273,1 Pcs,24,$6.54 
Dhamma Perfumes,Dhamma Fabrica Aromas Selva EXP 100ml Spy,6298141922297,1 Pcs,24,$6.54 
Dhamma Perfumes,Dhamma Fabrica Aromas Suave EXP 100ml Spy,6298141922334,1 Pcs,24,$6.54 
Dhamma Perfumes,Dhamma Hazel Nut Edp 100ml Spy,6298141922020,1 Pcs,30,$8.18 
Dhamma Perfumes,Dhamma  Hazel Parfum 100ml Spy,6298141921498,1 Pcs,26,$7.09 
Dhamma Perfumes,Dhamma L'eau Edp 100ml Spy,6298141921528,1 Pcs,27,$7.36 
Dhamma Perfumes,Dhamma Musk Candy Parfum 30ml Spy,6298141927254,1 Pcs,26,$7.09 
Dhamma Perfumes,Dhamma Musk Vanilla Parfum 30ml Spy,6298141927261,1 Pcs,26,$7.09 
Dhamma Perfumes,Dhamma  Naughty Parfum 100ml Spy,6298141921511,1 Pcs,26,$7.09 
Dhamma Perfumes,Dhamma Very Berry Parfum 100ml Spy,6298141921221,1 Pcs,24,$6.54 
Dignite,Dignite Ahlaam Arabian Edp 100ml Spy,5055810045586,25 Pcs,25,$6.82 
Dignite,Dignite Angry Man Edp 100ml Spy,5055810044688,1 Pcs,25,$6.82 
Dignite,Dignite Charming Edp 100ml Spy,5055810044947,20 Pcs,25,$6.82 
Dignite,Dignite Cool Man Edp 100ml Spy,5055810044701,24 Pcs,25,$6.82 
Dignite,Dignite Sports Man Edp 100ml Spy,5055810044695,1 Pcs,25,$6.82 
Dignite,Dignite Uros Al Arabian Edp 100ml Spy,5055810045609,23 Pcs,25,$6.82 
Dignite,Dignite Venturous Edp 100ml Spy,5055810044930,23 Pcs,25,$6.82 
Disney,Disney Frozen II 200ml Body Spy,8411114085814,24 Pcs,16.5,$4.50 
Disney,Disney Frozen II Edt 100ml+7ml LG+Zip Case Set,8411114085883,4 Pcs,60,$16.36 
Disney,Disney Frozen II Edt 100ml Spy,8411114086279,16 Pcs,37,$10.09 
Disney,Disney Frozen II Edt 30ml+Key Ring+Bracelets Set,8411114079806,6 Pcs,37,$10.09 
Disney,Disney Frozen II Edt 30ml Spy,8411114085791,5 Pcs,15,$4.09 
Disney,Disney Mickey Mouse 200ml Body Spy,8411114081564,13 Pcs,13,$3.55 
Disney,Disney Mickey Mouse Edt 100ml Spy,663350008234,35 Pcs,37,$10.09 
Disney,Disney Princess 200ml Body Spy,663350052367,17 Pcs,16.5,$4.50 
DJS Concept,Morena Noir Edt 100ml,7640130661479,1 Pcs,30,$8.18 
Emir Celestial Series,Emir Celestial Series Celestial Exp 100ml Spy,6292864825484,4 Pcs,50,$13.64 
Emir Celestial Series,Emir Celestial Series Fascination Exp 100ml Spy,6292864825491,4 Pcs,50,$13.64 
Emir Celestial Series,Emir Celestial Series Resurrection Exp 100ml Spy,6292864825477,4 Pcs,50,$13.64 
Emper,Emper Chifon Rose Couture W Edp 100ml+100BL+200Deo.Set,6291103665478,1 Pcs,42,$11.45 
Emper,Emper Chifon W Edp 100ml+250ml SG+200Deo.Set,6291108525524,18 Pcs,48,$13.09 
Emper,Emper Coral Party W Edp 95ml Spy,6291108520178,3 Pcs,24,$6.54 
Emper,Emper Coral W Edp 95ml Spy,6291103661050,33 Pcs,22,$6.00 
Emper,Emper Dare W Edp 100ml Spy,6291103669636,9 Pcs,47,$12.82 
Emper,Emper Eye Candy Pari W Edp 100ml Spy,6291108521779,8 Pcs,24,$6.54 
